title,url
Help Needed: YOTI Verification Issue with Just Eat Courier Account Opening,https://www.reddit.com/r/JustEatUK/comments/1drwsy4/help_needed_yoti_verification_issue_with_just_eat/
"Name verification. Mine’s correct, but did anyone else get this?",https://www.reddit.com/r/PiNetwork/comments/jvls43/name_verification_mines_correct_but_did_anyone/
Yoti KYCd and now...,https://www.reddit.com/r/PiNetwork/comments/ve6u6x/yoti_kycd_and_now/
What info does Yoti send to Pi network for KYC?,https://www.reddit.com/r/PiNetwork/comments/l16q2i/what_info_does_yoti_send_to_pi_network_for_kyc/
KYC Verification | Yoti Applicant,https://www.reddit.com/r/PiNetwork/comments/1itaur0/kyc_verification_yoti_applicant/
Age Verification,https://www.reddit.com/r/AvakinOfficial/comments/17gphl2/age_verification/
"Who is ""Yoti""?",https://www.reddit.com/r/PiNetwork/comments/gzxtxf/who_is_yoti/
How does the ability to receive a SMS message apparently prove that someone is an adult? (In the context of age verification in the UK.),https://www.reddit.com/r/AskUK/comments/1igndh4/how_does_the_ability_to_receive_a_sms_message/
Age verification,https://www.reddit.com/r/AvakinOfficial/comments/1dbtzlg/age_verification/
Age verification to go Live,https://www.reddit.com/r/Tiktokhelp/comments/1afkfby/age_verification_to_go_live/
Discord's face scanning age checks 'start of a bigger shift',https://www.reddit.com/r/unitedkingdom/comments/1k1ge0t/discords_face_scanning_age_checks_start_of_a/
I got this notification today about how I’m not 16 and my account will get deleted. What does this mean?,https://www.reddit.com/r/TikTok/comments/191n1p2/i_got_this_notification_today_about_how_im_not_16/
Is the discord face and id verification safe?,https://www.reddit.com/r/discordapp/comments/1c5gttc/is_the_discord_face_and_id_verification_safe/
Discord's Age Verification Handling is a joke,https://www.reddit.com/r/discordapp/comments/hxe7i6/discords_age_verification_handling_is_a_joke/
Tiktok age restricting videos without restriction mode on,https://www.reddit.com/r/Tiktokhelp/comments/txmel3/tiktok_age_restricting_videos_without_restriction/
Discord's Age Verification - A wildly flawed system,https://www.reddit.com/r/discordapp/comments/12cms68/discords_age_verification_a_wildly_flawed_system/
Discord rolling out Face and ID verification for UK users,https://www.reddit.com/r/unitedkingdom/comments/1k0gzve/discord_rolling_out_face_and_id_verification_for/
Is this normal to get this kind of request?,https://www.reddit.com/r/discordapp/comments/17yzduf/is_this_normal_to_get_this_kind_of_request/
A minor creates an OnlyFans promising they will post there when they turn 18. People believe that and pre-pay based on that belief and the assumption that there will be nudity. Were laws broken? [Florida],https://www.reddit.com/r/legaladviceofftopic/comments/1fqp9ua/a_minor_creates_an_onlyfans_promising_they_will/
"Is this a joke or bug? Being asked to ""verify age"" with a video selfie or ID on BROWSER Discord.",https://www.reddit.com/r/discordapp/comments/1jpyhsd/is_this_a_joke_or_bug_being_asked_to_verify_age/
Some Discord users now need to scan their face or ID to view sensitive material | The company says the age verification feature is “an experiment”,https://www.reddit.com/r/technology/comments/1k0nbxv/some_discord_users_now_need_to_scan_their_face_or/
Ways to verify someone age on a public discord server,https://www.reddit.com/r/discordapp/comments/183u9pu/ways_to_verify_someone_age_on_a_public_discord/
Are public servers allowed to ask to see government IDs for age verification?,https://www.reddit.com/r/discordapp/comments/1iq2gyr/are_public_servers_allowed_to_ask_to_see/
"Youtube have ""made changes"" to my account because they can't prove I am over 18",https://www.reddit.com/r/NewTubers/comments/1gwvkan/youtube_have_made_changes_to_my_account_because/
random age restrictions,https://www.reddit.com/r/Tiktokhelp/comments/1hx9itu/random_age_restrictions/
Does birthday matter?,https://www.reddit.com/r/Tiktokhelp/comments/1ij42jc/does_birthday_matter/
Re-verify identification on TikTok for TikTok Shop???,https://www.reddit.com/r/Tiktokhelp/comments/198ytlw/reverify_identification_on_tiktok_for_tiktok_shop/
Is There a way to effectively download age restricted videos from youtube in 2024? jdownloader is not working,https://www.reddit.com/r/DataHoarder/comments/1g8u1r8/is_there_a_way_to_effectively_download_age/
Verification of my bot,https://www.reddit.com/r/discordbots/comments/1g30134/verification_of_my_bot/
[Anti-Aging] Is the way the TikTok “aged” filter ages accurate?,https://www.reddit.com/r/SkincareAddiction/comments/14ubqqt/antiaging_is_the_way_the_tiktok_aged_filter_ages/
The way minors are treated in fandom,https://www.reddit.com/r/FanFiction/comments/sgec00/the_way_minors_are_treated_in_fandom/
What are your thoughts on the recent Texas pornhub age verification law?,https://www.reddit.com/r/AskFeminists/comments/1bkyvrt/what_are_your_thoughts_on_the_recent_texas/
minors in 18+ server??,https://www.reddit.com/r/PonyTown/comments/1k7bbay/minors_in_18_server/
How to verify age,https://www.reddit.com/r/teenagers/comments/g2603p/how_to_verify_age/
Ok... about the age verification.,https://www.reddit.com/r/roblox/comments/psnukf/ok_about_the_age_verification/
Am i the only who didn't get an age verification?,https://www.reddit.com/r/CharacterAI/comments/1hnb96v/am_i_the_only_who_didnt_get_an_age_verification/
"It's been talked about into the ground, but just had my experience with it finally. The whole ""The verification could be faked.""",https://www.reddit.com/r/VRchat/comments/1jyor3p/its_been_talked_about_into_the_ground_but_just/
MMW: The age verification laws that several red states passed is just so they can have a database for easy pickings if/when they make Pr0n illegal.,https://www.reddit.com/r/MarkMyWords/comments/18ra1ur/mmw_the_age_verification_laws_that_several_red/
Created a VRChat group today that is Age verification only in protest to all the instances I read in posts that complain about needing to share personal information just to hang out with other adults.,https://www.reddit.com/r/VRchat/comments/1jf3h4f/created_a_vrchat_group_today_that_is_age/
Does anyone else think opt in age verification would be useful if implemented on VRChat,https://www.reddit.com/r/VRchat/comments/1fx9ay3/does_anyone_else_think_opt_in_age_verification/
Age gating issues,https://www.reddit.com/r/VRchat/comments/1jif423/age_gating_issues/
CMV: no one under the age of 18 should be allowed on any kind of image-centric social media and those social media platforms should require photo verification to prevent minors from using them,https://www.reddit.com/r/changemyview/comments/kqnxeb/cmv_no_one_under_the_age_of_18_should_be_allowed/
I really wonder how the Christmas and new year is going to be with the age verification system,https://www.reddit.com/r/VRchat/comments/1hkc2xk/i_really_wonder_how_the_christmas_and_new_year_is/
Story/ experience,https://www.reddit.com/r/redditagainstpedos/comments/1i07mqc/story_experience/
Ranboo’s Shift to 18+ Content,https://www.reddit.com/r/mcytsnark/comments/1gff9z5/ranboos_shift_to_18_content/
Discord Begins Testing Facial Scans for Age Verification,https://www.reddit.com/r/anime_titties/comments/1k39i0e/discord_begins_testing_facial_scans_for_age/
Week 17 | Cybersecurity - technology - privacy News recap,https://www.reddit.com/r/nordvpn/comments/1k7l4b9/week_17_cybersecurity_technology_privacy_news/
"“10% error rate is okay“ - Leaked EU Commission document regarding Chat Control, the law that requires the mass surveillance of messages and photos",https://www.reddit.com/r/privacy/comments/voaicx/10_error_rate_is_okay_leaked_eu_commission/
"In lieu of a new Texas law forcing age-verification on adult websites, PornHub closes its doors to Texans. r/Texas reacts.",https://www.reddit.com/r/SubredditDrama/comments/1bezjtg/in_lieu_of_a_new_texas_law_forcing/
Appeal against EU’s new age verification policy?,https://www.reddit.com/r/privacy/comments/x9w9rg/appeal_against_eus_new_age_verification_policy/
Discord's New Age Verification Requires ID Or Face Scans For Some Users,https://www.reddit.com/r/anime_titties/comments/1k2dw5j/discords_new_age_verification_requires_id_or_face/
Age Verification to create Sony account,https://www.reddit.com/r/Helldivers/comments/1cj8sdy/age_verification_to_create_sony_account/
18+ Verification & ToS clarification,https://www.reddit.com/r/VRchat/comments/1hho8z9/18_verification_tos_clarification/
S.S. retierment concerns,https://www.reddit.com/r/SocialSecurity/comments/1k33gb6/ss_retierment_concerns/
Is this a scam or is it legit?,https://www.reddit.com/r/Scams/comments/1cjkhwj/is_this_a_scam_or_is_it_legit/
Don’t have your credit card? No food for you.,https://www.reddit.com/r/MaliciousCompliance/comments/bif90k/dont_have_your_credit_card_no_food_for_you/
AGE VERIFICATION IN YOUTH LACROSSE,https://www.reddit.com/r/lacrosse/comments/13rh0jx/age_verification_in_youth_lacrosse/
Age Verification for Small Online Alcohol Shop in Switzerland,https://www.reddit.com/r/Switzerland/comments/1jet5bt/age_verification_for_small_online_alcohol_shop_in/
Host is asking for personal information,https://www.reddit.com/r/vrbo/comments/1dongqe/host_is_asking_for_personal_information/
I got an email to verify my age of lose my gmail,https://www.reddit.com/r/google/comments/16azpfu/i_got_an_email_to_verify_my_age_of_lose_my_gmail/
Age verification for adult web sites advances in Florida House,https://www.reddit.com/r/law/comments/1984qsp/age_verification_for_adult_web_sites_advances_in/
"question about AGE verification, official Reddit position thereof. and if 3rd party Age verification is ALLOWED",https://www.reddit.com/r/modhelp/comments/n454ya/question_about_age_verification_official_reddit/
Introducing Age Verification | Developer Update,https://www.reddit.com/r/VRchat/comments/1h1dtac/introducing_age_verification_developer_update/
The Impact of Age Verification Measures Goes Beyond Porn Sites,https://www.reddit.com/r/technology/comments/1i9khhw/the_impact_of_age_verification_measures_goes/
My experience identifying various scams as a teller,https://www.reddit.com/r/Scams/comments/ye4fko/my_experience_identifying_various_scams_as_a/
Age limit BS,https://www.reddit.com/r/lacrosse/comments/1e4bfim/age_limit_bs/
Introducing Age Verification | Developer Update (VRChat),https://www.reddit.com/r/virtualreality/comments/1h1zmi2/introducing_age_verification_developer_update/
"Opinion: The age California verification law AB 3080 is poised sail past the senate and Governor's desk, becoming law. Requiring websites to collect a user's government issued ID to access adult websites.",https://www.reddit.com/r/privacy/comments/1d2ymvn/opinion_the_age_california_verification_law_ab/
"I was on adult web cam site, and I am still concerned I did something wrong.",https://www.reddit.com/r/offmychest/comments/1j3hkeo/i_was_on_adult_web_cam_site_and_i_am_still/
KYC verification under 18 on csfloat,https://www.reddit.com/r/csgo/comments/1jc88j9/kyc_verification_under_18_on_csfloat/
PonyTown NEEDS a System to Keep Minors/Underage Users OUT of the 18+ Server(s).,https://www.reddit.com/r/PonyTown/comments/18wf4wc/ponytown_needs_a_system_to_keep_minorsunderage/
Verification When Underage (Through Misunderstanding),https://www.reddit.com/r/Upwork/comments/hrb147/verification_when_underage_through/
Underage ID verification,https://www.reddit.com/r/FACEITcom/comments/1cknyns/underage_id_verification/
Here is (almost) everything you need,https://www.reddit.com/r/facebookdisabledme/comments/xrmq62/here_is_almost_everything_you_need/
"I went on web cam sites, and I still wonder if I did something wrong.",https://www.reddit.com/r/TrueOffMyChest/comments/1j3l2lo/i_went_on_web_cam_sites_and_i_still_wonder_if_i/
Anoying age verification.,https://www.reddit.com/r/OculusQuest/comments/1k4oduk/anoying_age_verification/
Major Adult Sites Blocked in Indiana,https://www.reddit.com/r/Indiana/comments/1gw6s9j/major_adult_sites_blocked_in_indiana/
Snapchat Quick Tips 👻,https://www.reddit.com/r/parenting_tech/comments/1k8k2gx/snapchat_quick_tips/
My Moms Gmail wants verification for age,https://www.reddit.com/r/GMail/comments/19aw2ll/my_moms_gmail_wants_verification_for_age/
r/ToyControl - Accessible 18+ Sexy Fun!,https://www.reddit.com/r/SexLoveandDisability/comments/18b23ls/rtoycontrol_accessible_18_sexy_fun/
Age verification on checkout ? what app is recommended,https://www.reddit.com/r/woocommerce/comments/18u02uf/age_verification_on_checkout_what_app_is/
Age verification methods Google,https://www.reddit.com/r/belgium/comments/l7r1c4/age_verification_methods_google/
Guest refused to give me identification or physical card at check in,https://www.reddit.com/r/TalesFromTheFrontDesk/comments/1cvq56k/guest_refused_to_give_me_identification_or/
Parental Consent for Age Verification?,https://www.reddit.com/r/RecRoom/comments/lcmx45/parental_consent_for_age_verification/
I'm confused about the id age verification stuff,https://www.reddit.com/r/supremecourt/comments/1cm6kjo/im_confused_about_the_id_age_verification_stuff/
Age verification?,https://www.reddit.com/r/AmongUs/comments/mjg848/age_verification/
"As a Korean living aboard, SKT’s hack might be a good thing in the long run",https://www.reddit.com/r/korea/comments/1k9l9qv/as_a_korean_living_aboard_skts_hack_might_be_a/
Son was asked to verify his age to contine using account but device wasn't handy to complete...,https://www.reddit.com/r/MetaQuestVR/comments/1fkwkwj/son_was_asked_to_verify_his_age_to_contine_using/
Age verification code not showing - no success with meta support,https://www.reddit.com/r/OculusQuest2/comments/1dtz52n/age_verification_code_not_showing_no_success_with/
Successful 2-Star Review Removed,https://www.reddit.com/r/airbnb_hosts/comments/1hcvq0h/successful_2star_review_removed/
Age Verification: Thoughts on an optional KYC like system?,https://www.reddit.com/r/VRchat/comments/1dp96jj/age_verification_thoughts_on_an_optional_kyc_like/
"I Built a Prompt Generator—Tell it What You Need, Get an Optimised Prompt",https://www.reddit.com/r/ChatGPTPromptGenius/comments/1ijsaqq/i_built_a_prompt_generatortell_it_what_you_need/
"I Built a Prompt Generator—Tell it What You Need, Get an Optimised Prompt",https://www.reddit.com/r/PromptEngineering/comments/1ijsayz/i_built_a_prompt_generatortell_it_what_you_need/
"Ryanair boarding pass blocked due to ""customer-verification"", which is not working",https://www.reddit.com/r/travel/comments/13s6fq4/ryanair_boarding_pass_blocked_due_to/
"HELP, Tinder Account locked asks for verification but I need to delete it",https://www.reddit.com/r/SwipeHelper/comments/qpib2t/help_tinder_account_locked_asks_for_verification/
"[OFFER] UK,Denmark,Poland Numbers available for verifications",https://www.reddit.com/r/phoneverification/comments/1k5cz58/offer_ukdenmarkpoland_numbers_available_for/
"AMA - I’m Gareth Damian Martin / Jump Over the Age, developer of the dice-driven RPG Citizen Sleeper 2: Starward Vector, launching this Friday! Ask Me Anything!",https://www.reddit.com/r/NintendoSwitch/comments/1icvl5h/ama_im_gareth_damian_martin_jump_over_the_age/
Verification method is excessive and unreasonable,https://www.reddit.com/r/FACEITcom/comments/1agzhsq/verification_method_is_excessive_and_unreasonable/
Playdate Achievements are here!,https://www.reddit.com/r/PlaydateDeveloper/comments/1ka6l03/playdate_achievements_are_here/
Now the social media age verification bill has passed...,https://www.reddit.com/r/AusMemes/comments/1h1wme5/now_the_social_media_age_verification_bill_has/
How can an older person enjoy this game.,https://www.reddit.com/r/VRchat/comments/1dnx0gf/how_can_an_older_person_enjoy_this_game/
Tinder are INDEED retaining facial data,https://www.reddit.com/r/SwipeHelper/comments/xla9is/tinder_are_indeed_retaining_facial_data/
Phone verification ultra error,https://www.reddit.com/r/discordapp/comments/13mnthg/phone_verification_ultra_error/
[Help] Safe Mode menu bug solutions?,https://www.reddit.com/r/VRchat/comments/81mox9/help_safe_mode_menu_bug_solutions/
18+ Rated Avatars,https://www.reddit.com/r/VRchat/comments/1j3bc4a/18_rated_avatars/
"The ensh*tific@tion has began anew. Notice the feature is locked behind a VRC+ pay wall? Well, because so many users are going to want this to escape sqeakers, be in ERP servers without minors, and etc.? You're (likely) going to have to get it, cause they'll be the only type of servers with adults.",https://www.reddit.com/r/oculus/comments/1ics6c0/the_enshtifiction_has_began_anew_notice_the/
"First S rank on an Expert+ song! I know Legend is probably the easiest Expert+, but I'm proud anyway!",https://www.reddit.com/r/beatsaber/comments/b5wg0c/first_s_rank_on_an_expert_song_i_know_legend_is/
These guys really f#@&$ me so far...,https://www.reddit.com/r/MetroPCS/comments/1jwcxvo/these_guys_really_f_me_so_far/
How long does it take to get to +750 credit score?,https://www.reddit.com/r/personalfinance/comments/tw58sf/how_long_does_it_take_to_get_to_750_credit_score/
Stuck in human verification loop,https://www.reddit.com/r/OpenAI/comments/104to37/stuck_in_human_verification_loop/
Is restorecord trustable?,https://www.reddit.com/r/discordapp/comments/15h2ck2/is_restorecord_trustable/
Does P == NP? A contemplation of electronic security and automation in Star Wars.,https://www.reddit.com/r/MawInstallation/comments/oysben/does_p_np_a_contemplation_of_electronic_security/
Constantly being accused of being a catfish! Any advice?,https://www.reddit.com/r/Bumble/comments/1iwii5a/constantly_being_accused_of_being_a_catfish_any/
is there a ginormous skill gap between expert and expert+ or am i just bad,https://www.reddit.com/r/beatsaber/comments/knlgeu/is_there_a_ginormous_skill_gap_between_expert_and/
Is Jumio safe?,https://www.reddit.com/r/patreon/comments/18of10m/is_jumio_safe/
How the FUCK do I get a A SS RANK FOR THE FLAWLESS TROPHY,https://www.reddit.com/r/beatsaber/comments/1bh96ff/how_the_fuck_do_i_get_a_a_ss_rank_for_the/
"OF Scammers on reddit - PSA (Kinda long, apologies)",https://www.reddit.com/r/Scams/comments/1f8uc3o/of_scammers_on_reddit_psa_kinda_long_apologies/
Killing an app by deleting what was so great about it.,https://www.reddit.com/r/CharacterAI/comments/1gbmr36/killing_an_app_by_deleting_what_was_so_great/
[REQUEST] Need 2 or 3 US phone numbers,https://www.reddit.com/r/phoneverification/comments/1k5obah/request_need_2_or_3_us_phone_numbers/
"Yee-haw, it's another Friday Roundup!",https://www.reddit.com/r/adultery/comments/1jm4enp/yeehaw_its_another_friday_roundup/
yubo app is asking for my ID because my face didnt look 17 (am very baby faced) and wont let me do anything unless i send it over to em,https://www.reddit.com/r/mildlyinfuriating/comments/zez269/yubo_app_is_asking_for_my_id_because_my_face/
Profile verification required - Banned on tinder,https://www.reddit.com/r/SwipeHelper/comments/rihdol/profile_verification_required_banned_on_tinder/
Current State of Escape From Tarkov Closed Alpha Test 0.9.1.1610,https://www.reddit.com/r/EscapefromTarkov/comments/92xkbb/current_state_of_escape_from_tarkov_closed_alpha/
Can someone tell me why this is happening?,https://www.reddit.com/r/VRchat/comments/v9uxmd/can_someone_tell_me_why_this_is_happening/
Looking for a place to escape public world hell?,https://www.reddit.com/r/VRchat/comments/1jw9mv3/looking_for_a_place_to_escape_public_world_hell/
Growing,https://www.reddit.com/r/skzcollection/comments/1jcqgej/growing/
How to fix “verification required” (can’t update payment methods),https://www.reddit.com/r/applehelp/comments/143j959/how_to_fix_verification_required_cant_update/
How is this possible?,https://www.reddit.com/r/VRchat/comments/zyjkfl/how_is_this_possible/
Is the leaderboard glitched?,https://www.reddit.com/r/beatsaber/comments/16dcchh/is_the_leaderboard_glitched/
"Do you guys know good cozy houses or apartments world to lie down and chill like this one? I've found a few, but wanna discover more!",https://www.reddit.com/r/VRchat/comments/1duj3ue/do_you_guys_know_good_cozy_houses_or_apartments/
How to spot a cheating man,https://www.reddit.com/r/FemaleDatingStrategy/comments/kokgrt/how_to_spot_a_cheating_man/
"As a father of 4, I have failed",https://www.reddit.com/r/offmychest/comments/14dvq0/as_a_father_of_4_i_have_failed/
What am I doing wrong?,https://www.reddit.com/r/onlyfansadvice/comments/1k5hbra/what_am_i_doing_wrong/
Age Verification set my age wrong,https://www.reddit.com/r/RobloxHelp/comments/1f3qfjr/age_verification_set_my_age_wrong/
"Are social media age restrictions actually protecting children, or just protecting platforms from legal trouble?",https://www.reddit.com/r/phishing/comments/1jruv05/are_social_media_age_restrictions_actually/
Bypass method for things,https://www.reddit.com/r/familylink/comments/1k8wjda/bypass_method_for_things/
"Age verification is broken, so I cannot log in or make any use of Discord. How can I correct this?",https://www.reddit.com/r/discordapp/comments/1fnb2s2/age_verification_is_broken_so_i_cannot_log_in_or/
FAQ,https://www.reddit.com/r/Wizz_App_Unofficial/comments/1gnm9mm/faq/
Can't get past age verification on the Steam app. Does anyone else have this issue?,https://www.reddit.com/r/macgaming/comments/1gp8706/cant_get_past_age_verification_on_the_steam_app/
"Are social media age restrictions actually protecting children, or just protecting platforms from legal trouble?",https://www.reddit.com/r/parentalcontrols/comments/1jrupx6/are_social_media_age_restrictions_actually/
"Captcha for Age Verification, verifying someone age range without ID-ing online",https://www.reddit.com/r/SideProject/comments/18r2t2q/captcha_for_age_verification_verifying_someone/
VPN to regain porn access in Kansas?,https://www.reddit.com/r/kansas/comments/1dqjr4m/vpn_to_regain_porn_access_in_kansas/
Buy Facebook Ads Accounts (work with USA IP),https://www.reddit.com/r/WhatsAppBeta/comments/1jo8hd9/buy_facebook_ads_accounts_work_with_usa_ip/
Sneaker Botting MEGA GUIDE,https://www.reddit.com/r/shoebots/comments/gcd1oy/sneaker_botting_mega_guide/
AI to Revolutionize ID Verification!,https://www.reddit.com/r/DAOLabs/comments/1g3ph56/ai_to_revolutionize_id_verification/
Way to legally verify discord accounts - alt and age verification?,https://www.reddit.com/r/discordapp/comments/1k708bk/way_to_legally_verify_discord_accounts_alt_and/
Discord begins experimenting with face scanning for age verification,https://www.reddit.com/r/technology/comments/1k22w11/discord_begins_experimenting_with_face_scanning/
How can Digital Identity Increase Trust? Embracing Technology for a Secure Future,https://www.reddit.com/r/idverification/comments/1g3ihpy/how_can_digital_identity_increase_trust_embracing/
Eugh: Discord is scanning some users' faces and IDs to 'experiment' with age verification features,https://www.reddit.com/r/gamingnews/comments/1k1umwy/eugh_discord_is_scanning_some_users_faces_and_ids/
"Wave of age verification laws sweeps the US, bringing opportunity for biometrics",https://www.reddit.com/r/biometrics_news/comments/1boq0h2/wave_of_age_verification_laws_sweeps_the_us/
Discord begins experimenting with face scanning for age verification,https://www.reddit.com/r/discordapp/comments/1k3okd8/discord_begins_experimenting_with_face_scanning/
[Tutorial] List of iOS Daemons And What They Do,https://www.reddit.com/r/jailbreak/comments/10v7j59/tutorial_list_of_ios_daemons_and_what_they_do/
Week 35 | Cybersecurity - technology - privacy | News recap,https://www.reddit.com/r/nordvpn/comments/1679p8j/week_35_cybersecurity_technology_privacy_news/
I need help with changing the age on my account,https://www.reddit.com/r/RobloxHelp/comments/1fbhbbo/i_need_help_with_changing_the_age_on_my_account/
Won't let me upload ID to verify my age and it's starting to make me mad,https://www.reddit.com/r/facebook/comments/1hdqucr/wont_let_me_upload_id_to_verify_my_age_and_its/
How can I check my age on c.ai?,https://www.reddit.com/r/CharacterAI/comments/1hlhg21/how_can_i_check_my_age_on_cai/
"What's new in e-commerce? 🔥 Week of April 7th, 2025",https://www.reddit.com/r/ShopifyeCommerce/comments/1jttya3/whats_new_in_ecommerce_week_of_april_7th_2025/
"Bill S-210 is Just the Beginning: How a Canadian Digital Lobby Group is Promoting a Standard to ""Foster Widespread Adoption of Age Verification Technologies in Canada""",https://www.reddit.com/r/CanadaPolitics/comments/1afopnx/bill_s210_is_just_the_beginning_how_a_canadian/
Let Talk about Verification,https://www.reddit.com/r/IRS/comments/1jdzuiv/let_talk_about_verification/
"Online age verification is coming, and privacy is on the chopping block | The internet could soon become a very different place",https://www.reddit.com/r/technology/comments/13ijq03/online_age_verification_is_coming_and_privacy_is/
"How age verification to access porn works in France: ‘They won’t know anything about you, other than that you’re an adult’",https://www.reddit.com/r/technology/comments/1cmflnz/how_age_verification_to_access_porn_works_in/
Ohio attempting to join other states in requiring ID to view explicit material on the web,https://www.reddit.com/r/Ohio/comments/1bznhr3/ohio_attempting_to_join_other_states_in_requiring/
"First Porn, Now Skin Cream? ‘Age Verification’ Bills Are Out Of Control",https://www.reddit.com/r/technology/comments/1jbio7h/first_porn_now_skin_cream_age_verification_bills/
Bill S-210 is Just the Beginning: How a Canadian Digital Lobby Group is Promoting a Standard to “Foster Widespread Adoption of Age Verification Technologies in Canada” - Michael Geist,https://www.reddit.com/r/canada/comments/1afji4d/bill_s210_is_just_the_beginning_how_a_canadian/
