title,url
3rd party age verification service protecting anonymity,https://www.reddit.com/r/Entrepreneur/comments/1f2dojy/3rd_party_age_verification_service_protecting/
Age Verification,https://www.reddit.com/r/ModSupport/comments/qnca3y/age_verification/
How best to verify user age?,https://www.reddit.com/r/modhelp/comments/670owa/how_best_to_verify_user_age/
"how does apps detect users age? Ignore Date of birth, is there any other possible way to detect age like through quiz, Deep learning or any other solution? Currently Facebook is facing similar problem of where min age is 13 but all 10 year old dudes create with fake date of birth. Is there any way ?",https://www.reddit.com/r/ProductManagement/comments/ua3q8l/how_does_apps_detect_users_age_ignore_date_of/
warning for the kiddies: it's likely that underage users would just be banned or kicked out,https://www.reddit.com/r/CharacterAI/comments/1gqj9tt/warning_for_the_kiddies_its_likely_that_underage/
Instagram Launches Age Verification Feature Using Artificial Intelligence In Brazil And India,https://www.reddit.com/r/technepal/comments/y649ml/instagram_launches_age_verification_feature_using/
Requesting age verification from buyers,https://www.reddit.com/r/CamGirlProblems/comments/18aw029/requesting_age_verification_from_buyers/
Adult Patreon age verification,https://www.reddit.com/r/patreon/comments/16hfade/adult_patreon_age_verification/
Best age verification method I've ever seen,https://www.reddit.com/r/gaming/comments/311fxl/best_age_verification_method_ive_ever_seen/
Age verification,https://www.reddit.com/r/help/comments/1jj5lvy/age_verification/
How long did it take for you all to get your age verified ?,https://www.reddit.com/r/roblox/comments/qr3fij/how_long_did_it_take_for_you_all_to_get_your_age/
Pornhub Proposes Device-Based Age Verification,https://www.reddit.com/r/privacy/comments/135icyv/pornhub_proposes_devicebased_age_verification/
Pornhub’s Modelhub age verification process,https://www.reddit.com/r/NoStupidQuestions/comments/jr13ez/pornhubs_modelhub_age_verification_process/
Other age verification methods beside passport in USA?,https://www.reddit.com/r/travel/comments/1i4qi7g/other_age_verification_methods_beside_passport_in/
Please Help: Age verification process on Chaturbate (got denied 8 tines now),https://www.reddit.com/r/CamGirlProblems/comments/f8tx6d/please_help_age_verification_process_on/
Texas Senator and Representative Introduce Age Verification Legislation,https://www.reddit.com/r/texas/comments/1214841/texas_senator_and_representative_introduce_age/
I cant access marketplace. Its been 2 days since I did the video self verification. I still havent been asked to do a new verification method. How do i fix this? I tried redownloading facebook. Im obviously above 18,https://www.reddit.com/r/facebook/comments/1iqo2s8/i_cant_access_marketplace_its_been_2_days_since_i/
Age verification broken.,https://www.reddit.com/r/RobloxHelp/comments/1dc71d4/age_verification_broken/
Can't change my age and ID verification is not working,https://www.reddit.com/r/RobloxHelp/comments/1h3sfhv/cant_change_my_age_and_id_verification_is_not/
"Age Verification in A teorical ""metaverse""",https://www.reddit.com/r/privacy/comments/1fmycfj/age_verification_in_a_teorical_metaverse/
How long does it take to get age verified in Ridibooks if you are a foreigner?,https://www.reddit.com/r/undertheoaktreebook/comments/1cvrsjj/how_long_does_it_take_to_get_age_verified_in/
"100% Automated age verification bot, why doesn't discord do this?",https://www.reddit.com/r/Discord_Bots/comments/wfqf04/100_automated_age_verification_bot_why_doesnt/
"Newbie2RP Asks: Age Verification, Your Private Data, and Mods' Training",https://www.reddit.com/r/BadRPerStories/comments/1df5oc1/newbie2rp_asks_age_verification_your_private_data/
UK demands adult content sites introduce 'effective' age verification methods,https://www.reddit.com/r/technology/comments/1i2rihd/uk_demands_adult_content_sites_introduce/
So I don't have any form of accepted ID verification,https://www.reddit.com/r/stripe/comments/1653ctr/so_i_dont_have_any_form_of_accepted_id/
TIKTOK LIVE AGE VERIFICATION ??,https://www.reddit.com/r/TikTokshop/comments/1d2s5jv/tiktok_live_age_verification/
We have to check ID regardless if you look old or not. Do not get mad please…,https://www.reddit.com/r/GameStop/comments/16h8bs5/we_have_to_check_id_regardless_if_you_look_old_or/
ID verification keeps getting rejected,https://www.reddit.com/r/TikTokshop/comments/1cc0jhw/id_verification_keeps_getting_rejected/
Escape Room Age,https://www.reddit.com/r/royalcaribbean/comments/183py3j/escape_room_age/
are Prison Escape supposed to play like this?,https://www.reddit.com/r/VRchat/comments/139ccs2/are_prison_escape_supposed_to_play_like_this/
Help creating an escape room,https://www.reddit.com/r/Constructedadventures/comments/1gavvj1/help_creating_an_escape_room/
Red door age policies,https://www.reddit.com/r/escaperooms/comments/146hyzv/red_door_age_policies/
Escape ID problems,https://www.reddit.com/r/aves/comments/57c3nb/escape_id_problems/
"The ensh*tific@tion has began anew. Notice the feature is locked behind a VRC+ pay wall? Well, because so many users are going to want this to escape sqeakers, be in ERP servers without minors, and etc.? You're (likely) going to have to get it, cause they'll be the only type of servers with adults.",https://www.reddit.com/r/Quest2/comments/1ics9tc/the_enshtifiction_has_began_anew_notice_the/
What happens if no one has an ID yet employees need an ID for the answer to a puzzle?,https://www.reddit.com/r/escaperooms/comments/pkmwaw/what_happens_if_no_one_has_an_id_yet_employees/
Age Restrictions,https://www.reddit.com/r/escaperooms/comments/zpe9dx/age_restrictions/
Escape room with strangers?,https://www.reddit.com/r/escaperooms/comments/7mqoo5/escape_room_with_strangers/
Escape Room Age Limit,https://www.reddit.com/r/royalcaribbean/comments/14g1b8n/escape_room_age_limit/
"I had been playing this game a lot before but now I tried to return to my old account and it's kinda stuck on age verification, I don't do a crazy age usually so I'm sure as a kid I either put 18 or 21, each time I put any age it acts like it works then reloads to age verification. I'm stuck",https://www.reddit.com/r/BloonsTDBattles/comments/ohf9iy/i_had_been_playing_this_game_a_lot_before_but_now/
"The Online Porn Free-for-All Is Coming to an End | Three decades into the internet era, the Supreme Court finally appears ready to uphold age-verification laws.",https://www.reddit.com/r/technology/comments/1ia3lva/the_online_porn_freeforall_is_coming_to_an_end/
Looking for ID verification apps,https://www.reddit.com/r/shopify/comments/1fzzspg/looking_for_id_verification_apps/
How do you verify identity of someone from OLD?,https://www.reddit.com/r/datingoverforty/comments/1d79b5n/how_do_you_verify_identity_of_someone_from_old/
Escape room type game for a 6 year old,https://www.reddit.com/r/Constructedadventures/comments/1hz6oj6/escape_room_type_game_for_a_6_year_old/
"First Porn, Now Skin Cream? ‘Age Verification’ Bills Are Out of Control",https://www.reddit.com/r/technology/comments/1j737nl/first_porn_now_skin_cream_age_verification_bills/
Account on hold? Now wants ID???,https://www.reddit.com/r/sugarlifestyleforum/comments/18cb4sa/account_on_hold_now_wants_id/
"so i just finished the age verification, shouldn't this update to 17+ or am i missing something?",https://www.reddit.com/r/RobloxHelp/comments/1gv5c6d/so_i_just_finished_the_age_verification_shouldnt/
I need ideas to convince my parents to let me verify my age,https://www.reddit.com/r/roblox/comments/1ccnwjm/i_need_ideas_to_convince_my_parents_to_let_me/
thispersondoesnotexist.com,https://www.reddit.com/r/Ruleshorror/comments/rijpzv/thispersondoesnotexistcom/
The date of birth you provided indicates you are under our minimum supportable age.,https://www.reddit.com/r/stripe/comments/17r14ak/the_date_of_birth_you_provided_indicates_you_are/
Pornhub to block two more states (Indiana & Kentucky) over age verification laws,https://www.reddit.com/r/technology/comments/1djkexq/pornhub_to_block_two_more_states_indiana_kentucky/
Age Banned.. legal issues,https://www.reddit.com/r/discordapp/comments/199fq28/age_banned_legal_issues/
Easy Age Verification app not working,https://www.reddit.com/r/shopify/comments/1cwk7ve/easy_age_verification_app_not_working/
Escape room for 10-11 years kids,https://www.reddit.com/r/sandiego/comments/1cmvoge/escape_room_for_1011_years_kids/
Escape doesn't take you to the bottom anymore?,https://www.reddit.com/r/discordapp/comments/tf9fkr/escape_doesnt_take_you_to_the_bottom_anymore/
how to bypass youtube age verification,https://www.reddit.com/r/privacy/comments/ppg4vr/how_to_bypass_youtube_age_verification/
Bypassing youtube's age verification,https://www.reddit.com/r/privacy/comments/1ezjbre/bypassing_youtubes_age_verification/
Is there any websites to bypass The YouTube age restriction?,https://www.reddit.com/r/Piracy/comments/1gtbnud/is_there_any_websites_to_bypass_the_youtube_age/
Have to pay for age verification?,https://www.reddit.com/r/AvakinOfficial/comments/17c18t6/have_to_pay_for_age_verification/
[Suggestion] Bypass age verification,https://www.reddit.com/r/Vanced/comments/mdmwti/suggestion_bypass_age_verification/
is there a wayy to bypass youtube age verification,https://www.reddit.com/r/youtube/comments/1fhvv8h/is_there_a_wayy_to_bypass_youtube_age_verification/
"When social media sites start demanding age verification, will you comply, abandon those sites, or find ways around it?",https://www.reddit.com/r/AskAnAustralian/comments/1hshrm4/when_social_media_sites_start_demanding_age/
Question on Age Verification,https://www.reddit.com/r/onlyfansadvice/comments/nmji6c/question_on_age_verification/
May paraan ba para mai-bypass itong Age confirmation nag screen?,https://www.reddit.com/r/ShopeePH/comments/1b5cbsc/may_paraan_ba_para_maibypass_itong_age/
How to bypass age restricted videos on youtube+reddit posts on tor?,https://www.reddit.com/r/TOR/comments/1hxjulr/how_to_bypass_age_restricted_videos_on/
Age verification bypass,https://www.reddit.com/r/RobloxHelp/comments/190abwm/age_verification_bypass/
How do i bypass the google age verification thing?,https://www.reddit.com/r/NoStupidQuestions/comments/1fldo8a/how_do_i_bypass_the_google_age_verification_thing/
how to bypass age verification ?,https://www.reddit.com/r/youtubedl/comments/nrcwbj/how_to_bypass_age_verification/
Age verification bypass ?,https://www.reddit.com/r/revancedextended/comments/16ypvcf/age_verification_bypass/
AGE VERIFICATION!! THANKS,https://www.reddit.com/r/ClaudeAI/comments/1jwykd9/age_verification_thanks/
I’m so frustrated with the ID verification,https://www.reddit.com/r/Mercari/comments/1j9pffv/im_so_frustrated_with_the_id_verification/
ID verification,https://www.reddit.com/r/CashApp/comments/1jn1nsx/id_verification/
"""Standard"" ID verification? Am I behind the times? When did this become standard?",https://www.reddit.com/r/BadRPerStories/comments/18r7g8v/standard_id_verification_am_i_behind_the_times/
UK ID Verification,https://www.reddit.com/r/DataAnnotationTech/comments/1jeaymy/uk_id_verification/
When did DA start doing ID verification?,https://www.reddit.com/r/DataAnnotationTech/comments/1e93l4l/when_did_da_start_doing_id_verification/
ID Verify?,https://www.reddit.com/r/CloudResearchConnect/comments/1egr4m4/id_verify/
Yubo id verification,https://www.reddit.com/r/Yubo_/comments/1eqpblk/yubo_id_verification/
Id verification,https://www.reddit.com/r/Mercari/comments/1azwy7q/id_verification/
Any banks that don't require ID verification?,https://www.reddit.com/r/Banking/comments/1csl00q/any_banks_that_dont_require_id_verification/
ID Verification,https://www.reddit.com/r/ProlificAc/comments/1cm3xps/id_verification/
got an email from them asking to confirm my identity by scanning my id?,https://www.reddit.com/r/CloudResearchConnect/comments/1eo3lbc/got_an_email_from_them_asking_to_confirm_my/
"Developer ID Verification: Photo required, while not recommended by government",https://www.reddit.com/r/androiddev/comments/1bfalyx/developer_id_verification_photo_required_while/
PWD ID verification,https://www.reddit.com/r/MentalHealthPH/comments/1gu00ku/pwd_id_verification/
Linkedin ID verification with withpersona. How safe or legal is this?,https://www.reddit.com/r/linkedin/comments/1clt22h/linkedin_id_verification_with_withpersona_how/
Keep away from GoDaddy! Forced ID verification after domain purchase,https://www.reddit.com/r/webhosting/comments/1goppd0/keep_away_from_godaddy_forced_id_verification/
How do y'all feel about having to send a pic of your ID for verification for so many apps?,https://www.reddit.com/r/japanresidents/comments/1gll89q/how_do_yall_feel_about_having_to_send_a_pic_of/
Identity verification?,https://www.reddit.com/r/delta/comments/1htyesa/identity_verification/
ID verification process / timeline / what to do,https://www.reddit.com/r/IRS/comments/10zuzix/id_verification_process_timeline_what_to_do/
"The ID Verification in ""about you""",https://www.reddit.com/r/CloudResearchConnect/comments/11hzrfd/the_id_verification_in_about_you/
The roblox id verification system in a nutshell.,https://www.reddit.com/r/GoCommitDie/comments/pwuozt/the_roblox_id_verification_system_in_a_nutshell/
Is it normal for ID verification to take longer than 10 days?,https://www.reddit.com/r/ProlificAc/comments/1czvlpi/is_it_normal_for_id_verification_to_take_longer/
"ID Verification failed, no reply from support for several weeks. (Pro member here)",https://www.reddit.com/r/artstation/comments/1e9032q/id_verification_failed_no_reply_from_support_for/
Is ID Verification the Only Method of Recovery?,https://www.reddit.com/r/yahoo/comments/17003ae/is_id_verification_the_only_method_of_recovery/
Identity verification online is impossible,https://www.reddit.com/r/SocialSecurity/comments/1jtrm96/identity_verification_online_is_impossible/
Parents without FSA ID verification restrictions lifted temporarily!!!,https://www.reddit.com/r/FAFSA/comments/1cgxt4p/parents_without_fsa_id_verification_restrictions/
EU wants online age verification by 2024 possibly with digital ID,https://www.reddit.com/r/programming/comments/uo8c52/eu_wants_online_age_verification_by_2024_possibly/
how to get around faceit id verification?,https://www.reddit.com/r/FACEITcom/comments/1hvfun8/how_to_get_around_faceit_id_verification/
ID Verification for Students,https://www.reddit.com/r/outlier_ai/comments/1di664m/id_verification_for_students/
Seeking is now requiring ID verification upon sign up.,https://www.reddit.com/r/sugarlifestyleforum/comments/1hpuxce/seeking_is_now_requiring_id_verification_upon/
Please write your emails and get into the streets. This ID verification law CANNOT be passed.,https://www.reddit.com/r/australian/comments/1goe918/please_write_your_emails_and_get_into_the_streets/
Verified ID with ID.me but am not able to use id verification tool to answer questions about my return?,https://www.reddit.com/r/IRS/comments/1ajrd5n/verified_id_with_idme_but_am_not_able_to_use_id/
ID verification needed for refund??,https://www.reddit.com/r/amazonprime/comments/15x3smc/id_verification_needed_for_refund/
Major ID change for every single Australian to be introduced with new verification system,https://www.reddit.com/r/australian/comments/1equh1o/major_id_change_for_every_single_australian_to_be/
Got this Apple ID Verification popup but this is my friend’s email. Should I be concerned?,https://www.reddit.com/r/ios/comments/1c17jsb/got_this_apple_id_verification_popup_but_this_is/
"How to resolve ID verification requirement online, rather than driving to AT&T store location?",https://www.reddit.com/r/ATT/comments/18zvnbb/how_to_resolve_id_verification_requirement_online/
VA website verifying state issued ID,https://www.reddit.com/r/Veterans/comments/15eq3e9/va_website_verifying_state_issued_id/
Are there cam sites that do not send age verification data (photo/ID) to other companies?,https://www.reddit.com/r/CamGirlsHelp/comments/1fmbxz0/are_there_cam_sites_that_do_not_send_age/
Worldcoin (PoH) on Pornhub for age verification,https://www.reddit.com/r/CryptoCurrency/comments/1io7dt6/worldcoin_poh_on_pornhub_for_age_verification/
Utah is poised to pass an age verification law for app stores | Utah has once again passed a bill that attempts to place new limits on children’s ability to access social media and other apps.,https://www.reddit.com/r/technology/comments/1j4k09o/utah_is_poised_to_pass_an_age_verification_law/
Age verification tech trial results still six months away,https://www.reddit.com/r/AustralianPolitics/comments/1gtpuv7/age_verification_tech_trial_results_still_six/
Senator Tries Bringing Anti-Porn Age Verification Law to New York,https://www.reddit.com/r/technology/comments/1iihooq/senator_tries_bringing_antiporn_age_verification/
Google to use digital driver’s licenses to verify the age of website users,https://www.reddit.com/r/technology/comments/1fg8vw3/google_to_use_digital_drivers_licenses_to_verify/
"Mass surveillance, emotion recognition, social scoring... These 8 uses of AI are now banned in Europe",https://www.reddit.com/r/privacy/comments/1ii7aaz/mass_surveillance_emotion_recognition_social/
French regulator releases technical reference on age verification,https://www.reddit.com/r/idverification/comments/1g51794/french_regulator_releases_technical_reference_on/
EFF to Fifth Circuit: Age Verification Laws Will Hurt More Than They Help,https://www.reddit.com/r/technology/comments/1fy53ep/eff_to_fifth_circuit_age_verification_laws_will/
Pornhub to leave five more states over age-verification laws,https://www.reddit.com/r/technology/comments/1djy3mh/pornhub_to_leave_five_more_states_over/
Bumble heightens safety measures with new ID verification feature | TechCrunch,https://www.reddit.com/r/technology/comments/1jdx5h9/bumble_heightens_safety_measures_with_new_id/
tiktok support age verification not working,https://www.reddit.com/r/Tiktokhelp/comments/1ff7514/tiktok_support_age_verification_not_working/
Looking to rent a refrigerated machine that has age verification technology in north Texas,https://www.reddit.com/r/vending/comments/1f6s6ua/looking_to_rent_a_refrigerated_machine_that_has/
Age Verification Systems Will Be a Personal Identifiable Information Nightmare,https://www.reddit.com/r/technology/comments/1ddju7x/age_verification_systems_will_be_a_personal/
Pornhub pulled access after Texas required age verification. Could the same happen in AZ?,https://www.reddit.com/r/technology/comments/1bvqsxd/pornhub_pulled_access_after_texas_required_age/
VPNs Are Not a Solution to Age Verification Laws,https://www.reddit.com/r/technology/comments/1i3nzz3/vpns_are_not_a_solution_to_age_verification_laws/
Age verification - how to implement,https://www.reddit.com/r/iOSProgramming/comments/1dnnfud/age_verification_how_to_implement/
PASS age verification without an ARC card? (US military spouse),https://www.reddit.com/r/Living_in_Korea/comments/1jos5b7/pass_age_verification_without_an_arc_card_us/
VPNs Are Not a Solution to Age Verification Laws,https://www.reddit.com/r/Foodforthought/comments/1i5n8po/vpns_are_not_a_solution_to_age_verification_laws/
Have any game devs implemented an age verification software for their game?,https://www.reddit.com/r/gamedev/comments/ttx4md/have_any_game_devs_implemented_an_age/
VPNs Are Not a Solution to Age Verification Laws,https://www.reddit.com/r/vpns/comments/1i4gmit/vpns_are_not_a_solution_to_age_verification_laws/
Browser/Desktop Age Verification?,https://www.reddit.com/r/HelpMeFind/comments/1jh2iil/browserdesktop_age_verification/
Identity verification services that include photo identification?,https://www.reddit.com/r/IdentityTheft/comments/1d7wcx0/identity_verification_services_that_include_photo/
VPNs Are Not a Solution to Age Verification Laws,https://www.reddit.com/r/DigitalPrivacy/comments/1i4eat5/vpns_are_not_a_solution_to_age_verification_laws/
Pornhub disabled in NC due to age verification requirements,https://www.reddit.com/r/asheville/comments/18t904i/pornhub_disabled_in_nc_due_to_age_verification/
Best Identity Verification Provider for a Small Fintech?,https://www.reddit.com/r/fintech/comments/1jfsrfz/best_identity_verification_provider_for_a_small/
3D Printing Business Solution Verification Survey (All Ages/Demographics),https://www.reddit.com/r/SampleSize/comments/1huq3su/3d_printing_business_solution_verification_survey/
Roblox Age Verification won't work,https://www.reddit.com/r/RobloxHelp/comments/1dahzbr/roblox_age_verification_wont_work/
Age Verification for Vape Machines,https://www.reddit.com/r/vending/comments/1fel6eb/age_verification_for_vape_machines/
That 14 day warning I got actually wasn't lying 🤦,https://www.reddit.com/r/PornhubComments/comments/1hrelun/that_14_day_warning_i_got_actually_wasnt_lying/
"I age verified but I do not have VC, any possible solutions?",https://www.reddit.com/r/RobloxHelp/comments/10mvk1r/i_age_verified_but_i_do_not_have_vc_any_possible/
Can I create an account without the (not working) age verification?,https://www.reddit.com/r/ChatGPT/comments/1fs926t/can_i_create_an_account_without_the_not_working/
"Every time I try to sign up, it redirects me to the age verification page. Any solutions?",https://www.reddit.com/r/LINEwebtoon/comments/nwn1z3/every_time_i_try_to_sign_up_it_redirects_me_to/
Help: How to bypass reddit ''Log in to confirm you're over 18''?,https://www.reddit.com/r/firefox/comments/z2ck6w/help_how_to_bypass_reddit_log_in_to_confirm_youre/
Age Verification Benefits,https://www.reddit.com/r/AvakinOfficial/comments/1cqxq01/age_verification_benefits/
Age verification shipping,https://www.reddit.com/r/Vent/comments/1k0invh/age_verification_shipping/
is there a way to bypass youtube age restrictions? I don't really like the idea of giving them my ID,https://www.reddit.com/r/Piracy/comments/1b79e5v/is_there_a_way_to_bypass_youtube_age_restrictions/
Age verification!,https://www.reddit.com/r/frenchie/comments/1g5ayf5/age_verification/
Is there ANY possible way to get past the roblox age verification.,https://www.reddit.com/r/RobloxHelp/comments/1een8sj/is_there_any_possible_way_to_get_past_the_roblox/
So sick of this!!! age verification id/credit card looping nightmare,https://www.reddit.com/r/OculusQuest/comments/1fign77/so_sick_of_this_age_verification_idcredit_card/
Twitter Age Restriction Locked [UNLOCK METHOD]: Also for people who messed up the first time and need assistance.,https://www.reddit.com/r/Twitter/comments/a3dnrb/twitter_age_restriction_locked_unlock_method_also/
Working bypass for YouTube's age-verification [No Login Needed][Tampermonkey],https://www.reddit.com/r/firefox/comments/nm4u0g/working_bypass_for_youtubes_ageverification_no/
"O2's age verification requires I either own a credit card, or face the shame of having someone assume I look up inappropriate images. I don't have a credit card.",https://www.reddit.com/r/britishproblems/comments/14p72v/o2s_age_verification_requires_i_either_own_a/
Validating your age with LINE of your provider doesn’t support it,https://www.reddit.com/r/japanlife/comments/x0i86f/validating_your_age_with_line_of_your_provider/
Age-verification law for pornographic websites allowed to go into effect,https://www.reddit.com/r/nashville/comments/1i19bj7/ageverification_law_for_pornographic_websites/
Unable to bypass youtube age verification. Any ideas?,https://www.reddit.com/r/nordvpn/comments/qew9f0/unable_to_bypass_youtube_age_verification_any/
How to avoid id verification,https://www.reddit.com/r/uber/comments/1jgfyxi/how_to_avoid_id_verification/
How do you stay compliant with legal requirements like age verification and content restrictions when running an adult site? Any tips for navigating the ever-changing regulations?,https://www.reddit.com/r/adultwebmastersonly/comments/1f2g0nl/how_do_you_stay_compliant_with_legal_requirements/
"Age verification modal handling. Cookie, localStorage or other.",https://www.reddit.com/r/nextjs/comments/zoe3z7/age_verification_modal_handling_cookie/
"Have anyone got problems with the ""Verify your age""?",https://www.reddit.com/r/Instagram/comments/ur1sfm/have_anyone_got_problems_with_the_verify_your_age/
Any loopholes for ID?,https://www.reddit.com/r/dlsu/comments/190jl4y/any_loopholes_for_id/
iOS screen time doesn’t have any loopholes,https://www.reddit.com/r/parentalcontrols/comments/1ibqy1b/ios_screen_time_doesnt_have_any_loopholes/
Surprising loophole that allows hackers to hack your account and prevents you from recovering it,https://www.reddit.com/r/facebook/comments/1fbgz3t/surprising_loophole_that_allows_hackers_to_hack/
Problems Verifying Identity for ID.me,https://www.reddit.com/r/IRS/comments/1ivbr7u/problems_verifying_identity_for_idme/
FOUND A LOOPHOLE: No SSN Parent (Married + File Jointly),https://www.reddit.com/r/FAFSA/comments/195ik5d/found_a_loophole_no_ssn_parent_married_file/
Veriff identity verification doesn't work for some reason. Any success stories?,https://www.reddit.com/r/TotalWireless/comments/1d8795v/veriff_identity_verification_doesnt_work_for_some/
Photo ID Verification Errors,https://www.reddit.com/r/betterment/comments/yadp6v/photo_id_verification_errors/
Anyone else having problems verifying their age?,https://www.reddit.com/r/Tinder/comments/1ddpovq/anyone_else_having_problems_verifying_their_age/
Identity Verification but never took my picture,https://www.reddit.com/r/Sparkdriver/comments/1gxi16t/identity_verification_but_never_took_my_picture/
Does anyone know of any loopholes for those in “illegal” states?,https://www.reddit.com/r/dfsports/comments/zwvet5/does_anyone_know_of_any_loopholes_for_those_in/
