title,url
age verification doesn’t do anything,https://www.reddit.com/r/oculus/comments/1go070d/age_verification_doesnt_do_anything/
California Advances Bill for Porn Site Age Verification | That last state you'd think to pass a porn site age verification law is getting close to doing just that.,https://www.reddit.com/r/technology/comments/1czoo9v/california_advances_bill_for_porn_site_age/
Why I Emphatically Oppose Online Age Verification Mandates,https://www.reddit.com/r/technology/comments/1jz6p8y/why_i_emphatically_oppose_online_age_verification/
Age Verification on youtube.,https://www.reddit.com/r/uBlockOrigin/comments/l79yu0/age_verification_on_youtube/
Kakaopage’s age verification wall,https://www.reddit.com/r/manhwa/comments/vy0hwn/kakaopages_age_verification_wall/
How to do Age verification,https://www.reddit.com/r/NewToReddit/comments/1j8r6pu/how_to_do_age_verification/
Will this finally end with the option for us to verify our age?,https://www.reddit.com/r/CharacterAI/comments/1gb1s8w/will_this_finally_end_with_the_option_for_us_to/
I am Alex @ BlueCheck - Ask me anything about Age Verification,https://www.reddit.com/r/OasisVape/comments/49zeh5/i_am_alex_bluecheck_ask_me_anything_about_age/
It's about time grindr implements age verification as a requirement to download,https://www.reddit.com/r/askgaybros/comments/1dxti1j/its_about_time_grindr_implements_age_verification/
I AM NOT ABLE TO VERIFY MY AGE,https://www.reddit.com/r/google/comments/xmpj12/i_am_not_able_to_verify_my_age/
Whats the deal with google wanting ID for age verification on youtube?,https://www.reddit.com/r/privacy/comments/1ej56x4/whats_the_deal_with_google_wanting_id_for_age/
How do I verify my age to get back my access to marketplace? Please help,https://www.reddit.com/r/facebook/comments/1gdrtwg/how_do_i_verify_my_age_to_get_back_my_access_to/
Whatsapp won't verify my age.,https://www.reddit.com/r/whatsapp/comments/1jlp0eo/whatsapp_wont_verify_my_age/
MS/XBox Account S. Korean Age Verification Blcok,https://www.reddit.com/r/XboxSupport/comments/1h0xdno/msxbox_account_s_korean_age_verification_blcok/
"How age verification laws could affect you, no matter how old you are",https://www.reddit.com/r/australian/comments/1cvckpr/how_age_verification_laws_could_affect_you_no/
EA Child Verification Is Real or Fake?,https://www.reddit.com/r/questions/comments/1gfvru6/ea_child_verification_is_real_or_fake/
Can't prove my age with ClearChemist,https://www.reddit.com/r/GenderGP/comments/yp4j9f/cant_prove_my_age_with_clearchemist/
Meta Prompts - Because Your LLM Can Do Better Than Hello World,https://www.reddit.com/r/LocalLLaMA/comments/1i2b2eo/meta_prompts_because_your_llm_can_do_better_than/
the age verification is so bad,https://www.reddit.com/r/MetaQuestVR/comments/1fxb4ln/the_age_verification_is_so_bad/
"In October, my PSN account was stolen. This is the story of how he did it. (spoiler) I chatted with the hacker and he used Sony's customer service.",https://www.reddit.com/r/gaming/comments/3tlv8j/in_october_my_psn_account_was_stolen_this_is_the/
Twitter Age Lock Megathread,https://www.reddit.com/r/Twitter/comments/8nb6sf/twitter_age_lock_megathread/
"'The fact that solutions don’t exist comes from the government’s own research. Briefing documents prepared for the eSafety Commissioner last year found that when it comes to online age verification, ‘no country in the world has solved this problem’.",https://www.reddit.com/r/PoliticsDownUnder/comments/1gn4ouy/the_fact_that_solutions_dont_exist_comes_from_the/
"Captcha for Age Verification, verifying someone age range without ID-ing online",https://www.reddit.com/r/SomebodyMakeThis/comments/18r2syu/captcha_for_age_verification_verifying_someone/
Age verification services,https://www.reddit.com/r/webdev/comments/18juqq3/age_verification_services/
"Daily Mail: Newsagents to sell 'porn passes' so adults visiting X-rated websites can prove they are over 18 when age verification laws come in to force | Stewart Paterson, 13 May 2018",https://www.reddit.com/r/KotakuInAction/comments/8jk7xf/daily_mail_newsagents_to_sell_porn_passes_so/
"Lets talk about NFTs, DAOs, Web3 and the metaverse. How does it work for DUMMIES?",https://www.reddit.com/r/Superstonk/comments/rqmdyc/lets_talk_about_nfts_daos_web3_and_the_metaverse/
Australia Bans Social Media for Kids Under 16 – Bold Move or Overreach?,https://www.reddit.com/r/AskIndia/comments/1h0zxao/australia_bans_social_media_for_kids_under_16/
"Ran into my first website that has blocked Texas, yesterday",https://www.reddit.com/r/texas/comments/18zey7c/ran_into_my_first_website_that_has_blocked_texas/
"where can i go to get age verified, and if it's not out yet when will it be?",https://www.reddit.com/r/VRchat/comments/1h7tcmi/where_can_i_go_to_get_age_verified_and_if_its_not/
A child faked her age to go out with me,https://www.reddit.com/r/BORUpdates/comments/1ief4x9/a_child_faked_her_age_to_go_out_with_me/
Caution about age verification,https://www.reddit.com/r/JurassicWorldAlive/comments/1g0vjht/caution_about_age_verification/
Meta Quest 3: Locked Out After Age Verification Update £500 Paperweight Due to Parent Account Setup Nightmare! How can this be legal?,https://www.reddit.com/r/MetaQuestVR/comments/1fx1wpc/meta_quest_3_locked_out_after_age_verification/
You're still handing out your old number after 5 years? Enjoy your appointments canceled.,https://www.reddit.com/r/pettyrevenge/comments/v0qeg3/youre_still_handing_out_your_old_number_after_5/
✨ A full checklist: How to get started on Only Fans ✨,https://www.reddit.com/r/onlyfansadvice/comments/16h0xwh/a_full_checklist_how_to_get_started_on_only_fans/
"I am Mark Porter, CTO at MongoDB. I love Tech, and especially delighting people with databases. I also used to work at Oracle, NASA, Amazon, and Grab. AMA.",https://www.reddit.com/r/IAmA/comments/l23dxl/i_am_mark_porter_cto_at_mongodb_i_love_tech_and/
"Girl married at 12, mother at 13 now 18, stuck in a life of misery",https://www.reddit.com/r/LegalAdviceIndia/comments/1hthjkm/girl_married_at_12_mother_at_13_now_18_stuck_in_a/
/r/Scams Common Scam Master Post,https://www.reddit.com/r/Scams/comments/n00o17/rscams_common_scam_master_post/
Indiana to require age verification to access porn online,https://www.reddit.com/r/YouthRights/comments/1bi3ums/well_this_is_terrifying_it_looks_like_pornhub_cut/
"One of two things is happening now: I am being scammed, or someone is trying to collect a 15+ year old debt - want to make sure I handle this correctly.",https://www.reddit.com/r/personalfinance/comments/oo82mx/one_of_two_things_is_happening_now_i_am_being/
There should be age verification processes for certain subs to avoid minors being harassed/objectified on certain subs,https://www.reddit.com/r/unpopularopinion/comments/se3xt1/there_should_be_age_verification_processes_for/
Got Deactivated for privacy violation.,https://www.reddit.com/r/Sparkdriver/comments/1hvld9i/got_deactivated_for_privacy_violation/
To the dommes that want to make it far in findom,https://www.reddit.com/r/paypigsupportgroup/comments/1jabznc/to_the_dommes_that_want_to_make_it_far_in_findom/
Has anyone actually seen groups with age verification or age verified users?,https://www.reddit.com/r/VRchat/comments/1hdopi2/has_anyone_actually_seen_groups_with_age/
Age verification proposals could expose people to exploitation,https://www.reddit.com/r/ukpolitics/comments/1i2vgib/age_verification_proposals_could_expose_people_to/
Member age verification on SM,https://www.reddit.com/r/CamGirlProblems/comments/1auhfxv/member_age_verification_on_sm/
Age verification?,https://www.reddit.com/r/CamGirlProblems/comments/1i6zcqy/age_verification/
"Those who are age verified, what’s it like?",https://www.reddit.com/r/VRchat/comments/1hog6cl/those_who_are_age_verified_whats_it_like/
Age verification is broken,https://www.reddit.com/r/LINEwebtoon/comments/naiioh/age_verification_is_broken/
Ring Verification is Obnoxious,https://www.reddit.com/r/Ring/comments/1d00ebu/ring_verification_is_obnoxious/
Tinder age verification not reading my ID,https://www.reddit.com/r/japanlife/comments/n4i53m/tinder_age_verification_not_reading_my_id/
How does getting Age-Verified work?,https://www.reddit.com/r/VRchat/comments/1js6dho/how_does_getting_ageverified_work/
"Is there currently any workaround for YT's ""Sign in to confirm your age"" error?",https://www.reddit.com/r/youtubedl/comments/1g5z3bq/is_there_currently_any_workaround_for_yts_sign_in/
IOS TIP! Game Changer!,https://www.reddit.com/r/loveafterporn/comments/15jhma4/ios_tip_game_changer/
Age Verification when Camping. Is it checked/required?,https://www.reddit.com/r/nationalparks/comments/18u2q10/age_verification_when_camping_is_it/
Persona ID verification,https://www.reddit.com/r/linkedin/comments/1amjpb7/persona_id_verification/
Pornhub disabled in NC due to age verification requirements,https://www.reddit.com/r/ncpolitics/comments/18t1fjl/pornhub_disabled_in_nc_due_to_age_verification/
Pornhub disabled in NC due to age verification requirements,https://www.reddit.com/r/Destiny/comments/18t0fc9/pornhub_disabled_in_nc_due_to_age_verification/
For those of you seeking to be informed about these class actions that are happening... and no this isn't just people who have lost who are upset and angry. This is far bigger than that. Money laundering. Racketeering. Massive payouts are on the way for those who have signed up. Shutdowns to follow.,https://www.reddit.com/r/ChumbaCasino/comments/1fqdom4/for_those_of_you_seeking_to_be_informed_about/
facebook won’t let me confirm my age on marketplace after failed video selfie,https://www.reddit.com/r/facebook/comments/1gfbhkr/facebook_wont_let_me_confirm_my_age_on/
They found the loophole,https://www.reddit.com/r/RocketLeague/comments/14ibh6c/they_found_the_loophole/
Would you confirm your age through a 3rd Party ID Verification service if it got you access to an 18+ VR Community?,https://www.reddit.com/r/virtualreality/comments/11ts2m4/would_you_confirm_your_age_through_a_3rd_party_id/
"Meta is using tricks to get your REAL personal information, and fight fake, random accounts. If anyone refuses, they brick your headset",https://www.reddit.com/r/virtualreality/comments/1et1ydr/meta_is_using_tricks_to_get_your_real_personal/
California is two steps away from making porn websites verify your age.,https://www.reddit.com/r/technology/comments/1czhe88/california_is_two_steps_away_from_making_porn/
Here's How to Answer the FAFSA Homeless Questions,https://www.reddit.com/r/FAFSA/comments/wkty93/heres_how_to_answer_the_fafsa_homeless_questions/
2015 — 2024 Timeline of events surrounding Replika,https://www.reddit.com/r/replika/comments/1c2gs0k/2015_2024_timeline_of_events_surrounding_replika/
I've just got a warning about age verification how dumb is this.,https://www.reddit.com/r/deliveroos/comments/1i56cvk/ive_just_got_a_warning_about_age_verification_how/
Issue with Age Verification and Card Payments on G-Snack Vending Machine with Nayax System,https://www.reddit.com/r/vending/comments/1go1x2y/issue_with_age_verification_and_card_payments_on/
Does the age verification work for anyone?,https://www.reddit.com/r/growtopia/comments/1k698wz/does_the_age_verification_work_for_anyone/
How Verification Works ✅,https://www.reddit.com/r/WatchExchangeBST/comments/1gps7xn/how_verification_works/
Verify age,https://www.reddit.com/r/Stadia/comments/rtgbpt/verify_age/
🇸🇪 Sweden Visa – Family Visit + Business Travel – Need Advice!,https://www.reddit.com/r/SchengenVisa/comments/1k4z1ub/sweden_visa_family_visit_business_travel_need/
The Worst Problem on Discord - DM Spam Bots (Owner Vent),https://www.reddit.com/r/Discord_Bots/comments/1jtm21p/the_worst_problem_on_discord_dm_spam_bots_owner/
How to Watch Pornhub in south carolina in 2025: Bypass the Ban,https://www.reddit.com/r/VPNsolutuons/comments/1ikbi1z/how_to_watch_pornhub_in_south_carolina_in_2025/
Help Needed: X Account Locked in Infinite Loop Error After Hacking Incident,https://www.reddit.com/r/twitterhelp/comments/1ffcqr7/help_needed_x_account_locked_in_infinite_loop/
Age verification,https://www.reddit.com/r/paypigsupportgroup/comments/1e9g06l/age_verification/
How do I confirm my age?,https://www.reddit.com/r/help/comments/v6engg/how_do_i_confirm_my_age/
How do I verify age without compromising identity?,https://www.reddit.com/r/AskAnAustralian/comments/1glbjag/how_do_i_verify_age_without_compromising_identity/
How do I confirm the age of a buyer?,https://www.reddit.com/r/CreatorsAdvice/comments/1ejatna/how_do_i_confirm_the_age_of_a_buyer/
Age verification for voice chat absolutely SUCKS imo.,https://www.reddit.com/r/roblox/comments/1hy2obj/age_verification_for_voice_chat_absolutely_sucks/
Pornography age-verification laws get warm reception at Supreme Court,https://www.reddit.com/r/Conservative/comments/1i240yd/pornography_ageverification_laws_get_warm/
Opinion: Requiring age-verification for porn won’t save children from online harm. But it will invade our privacy,https://www.reddit.com/r/canada/comments/1bzzrsx/opinion_requiring_ageverification_for_porn_wont/
Discord is scanning users' faces and IDs in Australia and the UK to 'experiment' with age verification features,https://www.reddit.com/r/pcmasterrace/comments/1k1nu96/discord_is_scanning_users_faces_and_ids_in/
January 1st 2000 is now the fake DOB used to get past age verification sites.,https://www.reddit.com/r/Showerthoughts/comments/7ngaxv/january_1st_2000_is_now_the_fake_dob_used_to_get/
Judge largely blocks Tennessee's porn site age verification law as other states enforce theirs,https://www.reddit.com/r/news/comments/1hvhbok/judge_largely_blocks_tennessees_porn_site_age/
Pornhub blocks Montana and North Carolina as their age verification laws take effect | The website says the states' ID requirement would put users' privacy at risk,https://www.reddit.com/r/technology/comments/18xhfm1/pornhub_blocks_montana_and_north_carolina_as/
"Porn in Florida: As age verification takes effect, some sites ignore it, some block access",https://www.reddit.com/r/florida/comments/1hsukw9/porn_in_florida_as_age_verification_takes_effect/
19F hi y’all I’m just trying to figure out 1.If I’m ugly but also 2.Do I look my age??? I tried to do a 50/50 of makeup and no makeup but teenage grocery clerks call me ma’am and people assume I’m my 15 y/o sister’s mom sometimes and idk how to make myself look younger lol verification at the end :),https://www.reddit.com/r/amiugly/comments/vlnb8c/19f_hi_yall_im_just_trying_to_figure_out_1if_im/
age question,https://www.reddit.com/r/SwagBucks/comments/17o9suj/age_question/
r/teenagers should have age verification,https://www.reddit.com/r/teenagers/comments/xqirij/rteenagers_should_have_age_verification/
Age verification on r/teenagers,https://www.reddit.com/r/teenagers/comments/1hyhweb/age_verification_on_rteenagers/
New teen safety updates (+response from Pinterest team about changing age),https://www.reddit.com/r/Pinterest/comments/1309d7h/new_teen_safety_updates_response_from_pinterest/
Age verification protocols for adult sites turn away more people who are lazy and don't want to register than teenagers lying about their age,https://www.reddit.com/r/Showerthoughts/comments/n1n62l/age_verification_protocols_for_adult_sites_turn/
What kind of IDs are 13-yr olds supposed to use?,https://www.reddit.com/r/roblox/comments/pwg8lj/what_kind_of_ids_are_13yr_olds_supposed_to_use/
"Google Family Link 13yr old age policy to detach from parental supervision without permission but then asking the child account to prove their age using government ID or the 13yr olds credit cards. r/Google auto deleted my post and upon review, refused to reverse the decision and answer my question.",https://www.reddit.com/r/privacy/comments/z4r77a/google_family_link_13yr_old_age_policy_to_detach/
As of April 2018 the UK will require all pornographic websites to have some form of age verification,https://www.reddit.com/r/worldnews/comments/6nsx3l/as_of_april_2018_the_uk_will_require_all/
How do I get into Facebook marketplace if I’m under 18? I’ve been trying for an hour and can’t find a way,https://www.reddit.com/r/teenagers/comments/trnp6d/how_do_i_get_into_facebook_marketplace_if_im/
Should teenagers below 18 be given access to contraceptives without age verification/parental consent?,https://www.reddit.com/r/polls/comments/qpacnw/should_teenagers_below_18_be_given_access_to/
"It's not just a 'teen social media ban', it's a national age verification scheme",https://www.reddit.com/r/europrivacy/comments/1g44s3x/its_not_just_a_teen_social_media_ban_its_a/
"Should children be prevented from watching pornography? Utah, America's most conservative state, requires robust age verification to view porn. Do you object to Utah's action? Would you mind other states following suit?",https://www.reddit.com/r/AskALiberal/comments/163ito7/should_children_be_prevented_from_watching/
"My teenage son (born in US)  just got his first job at a small local coffee shop.  Employer is asking for a copy of the following documents:  SS card, Drivers License, and Passport.  SS card and photo ID, I get is needed.  But is asking for the passport typical?",https://www.reddit.com/r/privacy/comments/1g6w3dr/my_teenage_son_born_in_us_just_got_his_first_job/
Here is what your teenage age says about you,https://www.reddit.com/r/teenagers/comments/1jsbx9o/here_is_what_your_teenage_age_says_about_you/
How do I get the age thing next to my name?,https://www.reddit.com/r/teenagers/comments/94us9w/how_do_i_get_the_age_thing_next_to_my_name/
"[WP] You're just a teenager and your friend sent you a link with age verification at 2 am. You set the year to 1940 to beat the verification. The site flashed random images and then blank. Disappointed, you went back to sleep. That morning, you woke as a 75 years old, as if you were born in 1940.",https://www.reddit.com/r/WritingPrompts/comments/9265al/wp_youre_just_a_teenager_and_your_friend_sent_you/
Reddit Should Be 18+,https://www.reddit.com/r/TheoryOfReddit/comments/18hu873/reddit_should_be_18/
Age verification,https://www.reddit.com/r/discordapp/comments/1k6hb7l/age_verification/
"It's not just a 'teen social media ban', it's a national age verification scheme",https://www.reddit.com/r/privacy/comments/1g425zb/its_not_just_a_teen_social_media_ban_its_a/
"U.K. Plan to Require Age Verification for Porn Sites Is ‘a Mess,’ Says Civil Liberties Group",https://www.reddit.com/r/Business_Analyst/comments/cboej6/uk_plan_to_require_age_verification_for_porn/
"Enforcing age verification checks for online porn sites could be detrimental to smaller ISPs and significantly increase online fraud. The measures, which are due to come into force in May, will require UK residents to prove they are 18 or over in order to get access to porn sites.",https://www.reddit.com/r/autotldr/comments/7orixm/enforcing_age_verification_checks_for_online_porn/
Phub now requiring official age verification from French users,https://www.reddit.com/r/europe/comments/svhlll/phub_now_requiring_official_age_verification_from/
Can a High School Student ID be used for a teen’s ID?,https://www.reddit.com/r/tsa/comments/1atajam/can_a_high_school_student_id_be_used_for_a_teens/
Porn age verification,https://www.reddit.com/r/Iowa/comments/1bfg4et/porn_age_verification/
Minors in 18+ server,https://www.reddit.com/r/PonyTown/comments/1gt2k4o/minors_in_18_server/
Are Age restrictions morally good for society?,https://www.reddit.com/r/GenZ/comments/1bex9ek/are_age_restrictions_morally_good_for_society/
Youngkin signs law requiring stringent age verification for porn sites - WTOP News,https://www.reddit.com/r/Virginia/comments/13iuvvu/youngkin_signs_law_requiring_stringent_age/
"Children should be forced to PROVE their age with documentation before they access social media, EE boss urges",https://www.reddit.com/r/unitedkingdom/comments/1gombh8/children_should_be_forced_to_prove_their_age_with/
Meta wants my underage kid to provide picture ID!,https://www.reddit.com/r/virtualreality/comments/18linpy/meta_wants_my_underage_kid_to_provide_picture_id/
How age verification could push children to dark sites,https://www.reddit.com/r/australia/comments/1gkbppu/how_age_verification_could_push_children_to_dark/
"This game is asking for an age verification and sending me to some website for parents to verify children. I'm 40, if I put in my birthrate under new child after entering the code it gave me it says my child is 2 years old.",https://www.reddit.com/r/GorillaTag/comments/1geg1gv/this_game_is_asking_for_an_age_verification_and/
How can I prevent a game from being accessed by minors?,https://www.reddit.com/r/RenPy/comments/1idhmpo/how_can_i_prevent_a_game_from_being_accessed_by/
Opinion: Requiring age-verification for porn won’t save children from online harm. But it will invade our privacy,https://www.reddit.com/r/CanadaPolitics/comments/1c06r59/opinion_requiring_ageverification_for_porn_wont/
Guys this is why they are fixing age verification and whatnot. I don't think it was actually us.. +mini rant,https://www.reddit.com/r/HighRiseMobileApp/comments/1k2jdyc/guys_this_is_why_they_are_fixing_age_verification/
Federal Judge Blocks Arkansas’ Social Media Age-Verification Law: What It Means for You,https://www.reddit.com/r/Socialode/comments/1jrgp1c/federal_judge_blocks_arkansas_social_media/
Is loyalfans reliable age verification?,https://www.reddit.com/r/paypigsupportgroup/comments/1cldt6c/is_loyalfans_reliable_age_verification/
Age-verification laws won’t protect kids from porn – and they could even make things worse,https://www.reddit.com/r/onguardforthee/comments/1fix18g/ageverification_laws_wont_protect_kids_from_porn/
Study: Age-Verification Laws Don't Work,https://www.reddit.com/r/ReasonMagazine/comments/1j9n7rq/study_ageverification_laws_dont_work/
Constant age verification. Why?,https://www.reddit.com/r/Steam/comments/7z1yxn/constant_age_verification_why/
Should porn websites require age verification to view adult content? The new bill proposal by Utah state Sen. Todd Weiler aims to prevent minors from accessing pornographic websites.,https://www.reddit.com/r/Utah/comments/10awkqr/should_porn_websites_require_age_verification_to/
Claim: Insufficient regulation and age verification in online games expose minors to inappropriate content and predatory behavior.,https://www.reddit.com/r/findfallacies/comments/1jwo3mn/claim_insufficient_regulation_and_age/
ID Verification - how strict is this process?,https://www.reddit.com/r/royalmail/comments/1d9arte/id_verification_how_strict_is_this_process/
New VIA Rail ID Verification Policy,https://www.reddit.com/r/ViaRail/comments/1j4j3ey/new_via_rail_id_verification_policy/
Age verification un-restricting itself,https://www.reddit.com/r/google/comments/1itfmjl/age_verification_unrestricting_itself/
Inquiry about Carrying Liquor Bottles: Age Verification and Legal Age Confusion in Delhi Metro,https://www.reddit.com/r/delhi/comments/1avc1x7/inquiry_about_carrying_liquor_bottles_age/
How do they know if you fail to verify age on an alcohol order?,https://www.reddit.com/r/AmazonFlexDrivers/comments/8u1bas/how_do_they_know_if_you_fail_to_verify_age_on_an/
Amazon age verification policy,https://www.reddit.com/r/AmazonFlexDrivers/comments/1h29rsh/amazon_age_verification_policy/
How age verification rules for porn and social media could impact millions of Australian adults,https://www.reddit.com/r/australia/comments/1cv59q3/how_age_verification_rules_for_porn_and_social/
Alcohol ID policy,https://www.reddit.com/r/walmart/comments/1c8bvk0/alcohol_id_policy/
Age verification,https://www.reddit.com/r/Monopoly_GO/comments/1fjyubh/age_verification/
The federal government has given an online age verification pilot the green light. Here's what we know about it,https://www.reddit.com/r/AustralianPolitics/comments/1ckos3n/the_federal_government_has_given_an_online_age/
What do you guys think of this? I had no idea about the new age verification laws till seeing this.,https://www.reddit.com/r/nycgaybros/comments/1dnoi22/what_do_you_guys_think_of_this_i_had_no_idea/
Influential 'Biblical' Right Wing Group Backs Georgia's Age Verification Bill,https://www.reddit.com/r/KeepOurNetFree/comments/1ahlljh/influential_biblical_right_wing_group_backs/
Verifying Age for Customers who Purchased Alcohol,https://www.reddit.com/r/samsclub/comments/1dlhern/verifying_age_for_customers_who_purchased_alcohol/
Why doesn’t Grindr ask for age verification.,https://www.reddit.com/r/askgaybros/comments/p9u4mi/why_doesnt_grindr_ask_for_age_verification/
"Age Verification Doesn't Work For My Account, Any Help?",https://www.reddit.com/r/ChatGPT/comments/1dqgk8y/age_verification_doesnt_work_for_my_account_any/
We need some form of age verification.,https://www.reddit.com/r/PlayDeceit/comments/1dqg952/we_need_some_form_of_age_verification/
age verification/changing age,https://www.reddit.com/r/imvu/comments/1fjawlf/age_verificationchanging_age/
Age Verification,https://www.reddit.com/r/CharacterAI/comments/1hizhid/age_verification/
Social media firms to be forced to ‘drive out’ under-age users,https://www.reddit.com/r/unitedkingdom/comments/1hk72cl/social_media_firms_to_be_forced_to_drive_out/
Discord age verification,https://www.reddit.com/r/discordapp/comments/1ecc003/discord_age_verification/
Very urgent question regarding age verification?,https://www.reddit.com/r/AvakinOfficial/comments/1geugb4/very_urgent_question_regarding_age_verification/
How do i report someone for being underage?,https://www.reddit.com/r/reddithelp/comments/1cbdw3t/how_do_i_report_someone_for_being_underage/
Why are there now all these proposed social media bans/age verifications,https://www.reddit.com/r/YouthRights/comments/1gcmdr1/why_are_there_now_all_these_proposed_social_media/
