title,url
"Hey all, is anyone willing to share how they do age verification? I see a lot of profiles that say they do it, but with so many guys not willing to show their face, it seems like the ID trick wouldn’t necessarily work.",https://www.reddit.com/r/onlyfansadvice/comments/xvxdka/hey_all_is_anyone_willing_to_share_how_they_do/
What is a way to confirm age without violating your privacy?,https://www.reddit.com/r/privacy/comments/qisu6s/what_is_a_way_to_confirm_age_without_violating/
"Facebook age verification, ID method not working, can i please get some tips to help?",https://www.reddit.com/r/facebook/comments/1g8kz3j/facebook_age_verification_id_method_not_working/
Who thinks that age verification is idiotic?,https://www.reddit.com/r/roblox/comments/pym7kh/who_thinks_that_age_verification_is_idiotic/
What are your thoughts on the age verification laws for porn?,https://www.reddit.com/r/AskConservatives/comments/18znr34/what_are_your_thoughts_on_the_age_verification/
Persona and Age Verification,https://www.reddit.com/r/VRchat/comments/1hgk7h6/persona_and_age_verification/
How many subs check for age verification before they engage a Dominant?,https://www.reddit.com/r/paypigsupportgroup/comments/14u2p1m/how_many_subs_check_for_age_verification_before/
Age verification teen account email legit?,https://www.reddit.com/r/MetaQuestVR/comments/1hv4l4f/age_verification_teen_account_email_legit/
"It’s not just a ‘teen social media ban’, it’s a national age verification scheme",https://www.reddit.com/r/technology/comments/1g3sds8/its_not_just_a_teen_social_media_ban_its_a/
Does the o2 Arena check IDs for teenagers?,https://www.reddit.com/r/AskUK/comments/1i55qty/does_the_o2_arena_check_ids_for_teenagers/
"It’s not just a ‘teen social media ban’, it’s a national age verification scheme",https://www.reddit.com/r/australia/comments/1g3pb1l/its_not_just_a_teen_social_media_ban_its_a/
Requiring age-verification for porn won’t save children from online harm. But it will invade our privacy,https://www.reddit.com/r/onguardforthee/comments/1bzv0yb/requiring_ageverification_for_porn_wont_save/
"You know that one Florida age-verification law? Yeah, turns out it’s much worse than it first seems.",https://www.reddit.com/r/facepalm/comments/1bny0mv/you_know_that_one_florida_ageverification_law/
"In all honesty- are ""modders"" and minors really bypassing 18+ verification? More context below",https://www.reddit.com/r/VRchat/comments/1iuaj4z/in_all_honesty_are_modders_and_minors_really/
"Age verification laws, Project 2025, Porn bans and YOU!",https://www.reddit.com/r/CamGirlProblems/comments/1ikav6n/age_verification_laws_project_2025_porn_bans_and/
No-one's really sure how age verification will work on under 16s social media ban,https://www.reddit.com/r/australian/comments/1gte9z6/noones_really_sure_how_age_verification_will_work/
CMV: A minor lying about their age on a dating app is NOT a victim.,https://www.reddit.com/r/changemyview/comments/1bz23lw/cmv_a_minor_lying_about_their_age_on_a_dating_app/
Age verification,https://www.reddit.com/r/paypigsupportgroup/comments/1bszu71/age_verification/
Tos Ruling on age verification?,https://www.reddit.com/r/discordapp/comments/roxpzt/tos_ruling_on_age_verification/
Thoughts on the adult content age verification changes coming in July,https://www.reddit.com/r/LegalAdviceUK/comments/1iimsbg/thoughts_on_the_adult_content_age_verification/
Age verification for alcohol,https://www.reddit.com/r/samsclub/comments/1fxrbsu/age_verification_for_alcohol/
Age verification for a phone charger?,https://www.reddit.com/r/AmazonDSPDrivers/comments/15zxj35/age_verification_for_a_phone_charger/
Monster age verification,https://www.reddit.com/r/Wetherspoons/comments/1iq1tth/monster_age_verification/
One way age verification could be exploited by criminals,https://www.reddit.com/r/privacy/comments/182wgy5/one_way_age_verification_could_be_exploited_by/
Is Age Verification still reliable in VRChat?,https://www.reddit.com/r/VRchat/comments/1j03tol/is_age_verification_still_reliable_in_vrchat/
My only concern that's stopping me from verifying my account to 18+,https://www.reddit.com/r/VRchat/comments/1hi3l5p/my_only_concern_thats_stopping_me_from_verifying/
Subs age verification,https://www.reddit.com/r/paypigsupportgroup/comments/1ah3yrm/subs_age_verification/
A Discussion on Age Verification,https://www.reddit.com/r/BadRPerStories/comments/1e93hvh/a_discussion_on_age_verification/
TikTok making me do age verification now?,https://www.reddit.com/r/TikTok/comments/1j7lfvp/tiktok_making_me_do_age_verification_now/
Age Verification in Findom and Sex Work,https://www.reddit.com/r/FreshFinZone/comments/1iyok7z/age_verification_in_findom_and_sex_work/
OnlyFans Age Verification: How to get verified,https://www.reddit.com/r/onlyfansbizschool/comments/13bxrbb/onlyfans_age_verification_how_to_get_verified/
Credit Card Age Verification,https://www.reddit.com/r/Dungeonborne/comments/1eatm24/credit_card_age_verification/
Age verification rumors,https://www.reddit.com/r/VRchat/comments/1h8p7s5/age_verification_rumors/
"How to circumvent that ""Korea Only"" Google Age Verification pop up?",https://www.reddit.com/r/seoul/comments/v3say2/how_to_circumvent_that_korea_only_google_age/
Does VPN bypass PornHub age verification requirements?,https://www.reddit.com/r/Louisiana/comments/102zcly/does_vpn_bypass_pornhub_age_verification/
How do I bypass the new youtube age restriction block?,https://www.reddit.com/r/privacy/comments/ljp02h/how_do_i_bypass_the_new_youtube_age_restriction/
Third party online identity selfie verification,https://www.reddit.com/r/privacy/comments/1bhhc5v/third_party_online_identity_selfie_verification/
Keep your age verification bouncers away from public game lobbies,https://www.reddit.com/r/VRchat/comments/1jme0ir/keep_your_age_verification_bouncers_away_from/
"Youtube Age Verification Bypass on Firefox, Windows 10",https://www.reddit.com/r/privacy/comments/nb5qtc/youtube_age_verification_bypass_on_firefox/
Bypass Age Verification on Porn Sites,https://www.reddit.com/r/askgaybros/comments/1iikeqr/bypass_age_verification_on_porn_sites/
[Suggestion] A way to bypass the (new and bad) age verification in the EU.,https://www.reddit.com/r/Vanced/comments/ma73v9/suggestion_a_way_to_bypass_the_new_and_bad_age/
"On iPhone, are there any apps I can use to bypass the age verification thing for YouTube?",https://www.reddit.com/r/privacy/comments/ua50z4/on_iphone_are_there_any_apps_i_can_use_to_bypass/
Any extensions to bypass age verification on youtube + reddit?,https://www.reddit.com/r/firefox/comments/1hxjtux/any_extensions_to_bypass_age_verification_on/
Is there a way to bypass the age restriction without verification/ID etc,https://www.reddit.com/r/youtubedl/comments/onkqyy/is_there_a_way_to_bypass_the_age_restriction/
What do you guys do to bypass the age-check verification?,https://www.reddit.com/r/youtube/comments/1dh47f9/what_do_you_guys_do_to_bypass_the_agecheck/
ID verification,https://www.reddit.com/r/FreeCash/comments/1ied4gn/id_verification/
Is ID verification safe?,https://www.reddit.com/r/roblox/comments/1hra7h6/is_id_verification_safe/
IF YOU NEED ID VERIFICATION - READ THIS!!,https://www.reddit.com/r/IRS/comments/lzb2wl/if_you_need_id_verification_read_this/
Is there a way of getting around verifying your ID,https://www.reddit.com/r/InstacartShoppers/comments/vmz5jf/is_there_a_way_of_getting_around_verifying_your_id/
Is it just me or does it feel super sketchy uploading an ID to get verified on YouTube?,https://www.reddit.com/r/NewTubers/comments/1cyeujd/is_it_just_me_or_does_it_feel_super_sketchy/
Why are they now asking for identity verification all of a sudden?,https://www.reddit.com/r/DataAnnotationTech/comments/1fj68od/why_are_they_now_asking_for_identity_verification/
Identity Verification,https://www.reddit.com/r/DataAnnotationTech/comments/1fdtjb7/identity_verification/
Social media ban: How Australia will implement age-assessment technology,https://www.reddit.com/r/australia/comments/1h4o7zy/social_media_ban_how_australia_will_implement/
Ex “OF Agency Recruiter” claims there’s is no age verification when uploading content to OF etc,https://www.reddit.com/r/SnarkAntiSexWork/comments/1humcz4/ex_of_agency_recruiter_claims_theres_is_no_age/
How do age verification laws (or any other law really) actually work on the internet,https://www.reddit.com/r/legaladviceofftopic/comments/194uvqu/how_do_age_verification_laws_or_any_other_law/
Federal judge declares Arkansas social media age-verification law unconstitutional,https://www.reddit.com/r/technology/comments/1jpm70o/federal_judge_declares_arkansas_social_media/
"No, Conscripting The App Stores Doesn’t Solve The Problems With Age Verification",https://www.reddit.com/r/technology/comments/1idy72z/no_conscripting_the_app_stores_doesnt_solve_the/
the age verification prompt,https://www.reddit.com/r/MetaQuestVR/comments/1fkxf9h/the_age_verification_prompt/
"How to age verify,please help me",https://www.reddit.com/r/Living_in_Korea/comments/1f39o9o/how_to_age_verifyplease_help_me/
What is your opinion on age verification on porn sites?,https://www.reddit.com/r/Destiny/comments/1i3kmbx/what_is_your_opinion_on_age_verification_on_porn/
Roblox age verification,https://www.reddit.com/r/RobloxHelp/comments/qq5ho8/roblox_age_verification/
Google Asking for ID/Credit Card age verification for 14 year old account.,https://www.reddit.com/r/google/comments/kthfkh/google_asking_for_idcredit_card_age_verification/
VPNs Are Not a Solution to Age Verification Laws,https://www.reddit.com/r/privacy/comments/1i3ru1k/vpns_are_not_a_solution_to_age_verification_laws/
[Suggestion] Bypass Verify Age,https://www.reddit.com/r/Vanced/comments/mkjkeq/suggestion_bypass_verify_age/
"Help! Google wants to ""verify"" my age that I'm 18 or older in order to install a dating app from Play Market, but I absolutely don't want to send my ID nor my credit card. How can I bypass it?",https://www.reddit.com/r/PrivacyGuides/comments/u8q4ib/help_google_wants_to_verify_my_age_that_im_18_or/
Indiana to require age verification to access porn online,https://www.reddit.com/r/Indiana/comments/1bfdta8/indiana_to_require_age_verification_to_access/
what websites should I use to bypass YouTube age verification?,https://www.reddit.com/r/Piracy/comments/104rubf/what_websites_should_i_use_to_bypass_youtube_age/
"YouTube prompting me verify my age, anyone know how i can avoid this?",https://www.reddit.com/r/uBlockOrigin/comments/ms7dbg/youtube_prompting_me_verify_my_age_anyone_know/
Age verification is really implemented poorly.,https://www.reddit.com/r/OculusQuest/comments/1c37zq7/age_verification_is_really_implemented_poorly/
US states requiring age verification affecting traffic yes?,https://www.reddit.com/r/CamGirlProblems/comments/1hworpv/us_states_requiring_age_verification_affecting/
River Financial: problems with identity verification,https://www.reddit.com/r/BitcoinBeginners/comments/1c1jh60/river_financial_problems_with_identity/
Can't purchase LRC due to ID verification problems with Ramp? Here is a workaround!,https://www.reddit.com/r/loopringorg/comments/tb1q4i/cant_purchase_lrc_due_to_id_verification_problems/
Problems verifying identity with OH|ID… any solutions?,https://www.reddit.com/r/Ohio/comments/18yv59n/problems_verifying_identity_with_ohid_any/
Going about age verification,https://www.reddit.com/r/privacy/comments/1gbql6k/going_about_age_verification/
What do you think about age verification laws ?,https://www.reddit.com/r/AskALiberal/comments/1iu4jca/what_do_you_think_about_age_verification_laws/
Why does it seem age verification is… not a thing?,https://www.reddit.com/r/Ebay/comments/15qy3nh/why_does_it_seem_age_verification_is_not_a_thing/
Age Verification ✅,https://www.reddit.com/r/AvakinOfficial/comments/17blmt0/age_verification/
Is age verification not enough?,https://www.reddit.com/r/VRchat/comments/1jn475f/is_age_verification_not_enough/
How do you handle checking if someone is 18 before Age Verification goes live?,https://www.reddit.com/r/VRchat/comments/1hehgro/how_do_you_handle_checking_if_someone_is_18/
Hinge date lied about his age. Is there a way to avoid this?,https://www.reddit.com/r/dating/comments/1aw7f3f/hinge_date_lied_about_his_age_is_there_a_way_to/
Do y’all lie about your child’s age for free entry?,https://www.reddit.com/r/toddlers/comments/1j3ybws/do_yall_lie_about_your_childs_age_for_free_entry/
Useful Information and Links,https://www.reddit.com/r/NSFWfor3PA/comments/18ai7bl/useful_information_and_links/
Randomly Age Restricted,https://www.reddit.com/r/Tiktokhelp/comments/1hwc2oc/randomly_age_restricted/
"Trust Fund, forced to Use Yoti (Digital ID which scans face and records voice) don't feel comfortable",https://www.reddit.com/r/UKPersonalFinance/comments/17fbjb5/trust_fund_forced_to_use_yoti_digital_id_which/
How safe is Yoti?,https://www.reddit.com/r/PiNetwork/comments/j4w9ev/how_safe_is_yoti/
Yoti Kyc,https://www.reddit.com/r/PiNetwork/comments/1hrrnjb/yoti_kyc/
Yoti ID,https://www.reddit.com/r/PiNetwork/comments/1iplet1/yoti_id/
yoti age verification,https://www.reddit.com/r/FacebookMarketplace/comments/1gmr5ek/yoti_age_verification/
Tiktok age verification is taking a LOT of time,https://www.reddit.com/r/Tiktokhelp/comments/1hud679/tiktok_age_verification_is_taking_a_lot_of_time/
"discord is asking me to verify my age to see stuff my gf sends me. It's asking for a god damn face scan or my ID. I'm not giving it my ID, and the face scan doesn't seem to work at all.",https://www.reddit.com/r/discordapp/comments/1k03k0y/discord_is_asking_me_to_verify_my_age_to_see/
Age verification bot,https://www.reddit.com/r/discordbots/comments/1iywv8b/age_verification_bot/
How does Discord know my age?,https://www.reddit.com/r/discordapp/comments/1g1771v/how_does_discord_know_my_age/
No-one's really sure how age verification will work on under 16s social media ban,https://www.reddit.com/r/technology/comments/1gtefsb/noones_really_sure_how_age_verification_will_work/
Supreme Court to review pornography age verification requirements - Washington Examiner,https://www.reddit.com/r/fourthwavewomen/comments/1i20s3n/supreme_court_to_review_pornography_age/
Just got age verified!!!,https://www.reddit.com/r/VRchat/comments/1hggyto/just_got_age_verified/
Age verification,https://www.reddit.com/r/polyai/comments/1g01b2o/age_verification/
Age Verification FAQ - You can only verify 1 account per ID,https://www.reddit.com/r/VRchat/comments/1h5qqbg/age_verification_faq_you_can_only_verify_1/
Age verification is now open to VRC+ subscribers,https://www.reddit.com/r/VRchat/comments/1icgnpg/age_verification_is_now_open_to_vrc_subscribers/
Discord's face scanning age checks 'start of a bigger shift',https://www.reddit.com/r/privacy/comments/1k1vt7p/discords_face_scanning_age_checks_start_of_a/
Virginia's Age Verification On Adult Websites Is Worse Than You Think,https://www.reddit.com/r/Virginia/comments/14mae2p/virginias_age_verification_on_adult_websites_is/
New email from NaNoWriMo is…interesting,https://www.reddit.com/r/nanowrimo/comments/1fvbegu/new_email_from_nanowrimo_isinteresting/
RPIs and Age Verification?,https://www.reddit.com/r/MUD/comments/wtan2k/rpis_and_age_verification/
"Faceit-Extender: Enhancing Faceit with Smurf Detection chance, Levels Over 10, and 'Have We Met' Features!",https://www.reddit.com/r/GlobalOffensive/comments/1gzgv8o/faceitextender_enhancing_faceit_with_smurf/
"""Age verification"" on Google Form.",https://www.reddit.com/r/GoogleAppsScript/comments/10qmhrg/age_verification_on_google_form/
Verifying age for a child,https://www.reddit.com/r/sixflags/comments/u3pnpy/verifying_age_for_a_child/
"Online age verification is coming, and privacy is on the chopping block",https://www.reddit.com/r/privacy/comments/13j500w/online_age_verification_is_coming_and_privacy_is/
Help: People who changed CPU recently can't get the verification mail for the love of god,https://www.reddit.com/r/EscapefromTarkov/comments/18uasc5/help_people_who_changed_cpu_recently_cant_get_the/
Stuck in a verification loop on my phone- I complete the process and get this message but then go back to stage one when I press continue. Any ideas on how to actually log in?,https://www.reddit.com/r/facebook/comments/rijmay/stuck_in_a_verification_loop_on_my_phone_i/
Can someone help me bypass the age verification error?,https://www.reddit.com/r/youtubedl/comments/1hy1yeo/can_someone_help_me_bypass_the_age_verification/
How to bypass YouTube age verification?,https://www.reddit.com/r/StacherIO/comments/1dhex65/how_to_bypass_youtube_age_verification/
Hey guys I’m not sure but I think age verification is out and we need 900 more posts about it.,https://www.reddit.com/r/VRchat/comments/1hgv7hj/hey_guys_im_not_sure_but_i_think_age_verification/
"Age verification seems like a good idea, but is it worth normalizing uploading your ID and submitting a picture to a company like this? I'm curious where people stand on this.",https://www.reddit.com/r/BrettCooper/comments/1bg0hw4/age_verification_seems_like_a_good_idea_but_is_it/
Checking IDs for people obviously of age.,https://www.reddit.com/r/TalesFromYourServer/comments/rgwr3m/checking_ids_for_people_obviously_of_age/
For the people that want an age verification with an ID.,https://www.reddit.com/r/CharacterAI/comments/1gd5b3x/for_the_people_that_want_an_age_verification_with/
Google asking a passport or ID-card for age verification is just another ploy to collect more personal data,https://www.reddit.com/r/privacy/comments/17s2mvz/google_asking_a_passport_or_idcard_for_age/
"Do 'much, much more' on age verification, social media firms told",https://www.reddit.com/r/ukpolitics/comments/1h1jmz5/do_much_much_more_on_age_verification_social/
age verification,https://www.reddit.com/r/replika/comments/12h5gfx/age_verification/
Age Verification on Google/Youtube,https://www.reddit.com/r/Living_in_Korea/comments/13l1f4l/age_verification_on_googleyoutube/
Google's asking me to verify my age by sending either creditcard details or my ID,https://www.reddit.com/r/google/comments/rlfuqz/googles_asking_me_to_verify_my_age_by_sending/
DETAILED step-by-step age verification guide for Ridibooks.,https://www.reddit.com/r/undertheoaktreebook/comments/ud5xvu/detailed_stepbystep_age_verification_guide_for/
[Question] Is there any way to get around YouTube's age verification?,https://www.reddit.com/r/Vanced/comments/n86gi1/question_is_there_any_way_to_get_around_youtubes/
Will my Age Verification stay if I only subscribe to VRC+ for 1-Month?,https://www.reddit.com/r/VRchat/comments/1iefs5f/will_my_age_verification_stay_if_i_only_subscribe/
World Verification is kind of ridiculous,https://www.reddit.com/r/VRchat/comments/1i0701o/world_verification_is_kind_of_ridiculous/
Still no workaround for LINE Age Verification on MVNOs?,https://www.reddit.com/r/japanlife/comments/9wcwk8/still_no_workaround_for_line_age_verification_on/
PLEASE fix the age verification!,https://www.reddit.com/r/CharacterAI/comments/1hd0das/please_fix_the_age_verification/
I cannot stand “age verifiers”,https://www.reddit.com/r/VRchat/comments/1jpfvnr/i_cannot_stand_age_verifiers/
Age verification update video,https://www.reddit.com/r/VRchat/comments/1hbfdcc/age_verification_update_video/
Age Gating instances (Verified),https://www.reddit.com/r/VRchat/comments/1j9dt4z/age_gating_instances_verified/
Age verification measures for social media is probably intended to identify adults not children,https://www.reddit.com/r/LowStakesConspiracies/comments/1gwry0y/age_verification_measures_for_social_media_is/
"Pornhub Is Now Blocked In Almost All of the U.S. South | As of today, three more states join the list of 17 that can't access Pornhub because of age verification laws.",https://www.reddit.com/r/AnythingGoesNews/comments/1hr88jl/pornhub_is_now_blocked_in_almost_all_of_the_us/
parental controls when my age is verified??,https://www.reddit.com/r/RobloxHelp/comments/1ie710m/parental_controls_when_my_age_is_verified/
Literally anyone complaining about the age verification system for GTA is under the age of 17💀,https://www.reddit.com/r/GTA/comments/1geyf98/literally_anyone_complaining_about_the_age/
Age verification,https://www.reddit.com/r/ClashOfClans/comments/1ip9mvq/age_verification/
Age Verification (RUMOURS),https://www.reddit.com/r/VRchat/comments/1etv1tp/age_verification_rumours/
Canada’s Leaders Must Reject Overbroad Age Verification Bill,https://www.reddit.com/r/privacy/comments/1fl6vgy/canadas_leaders_must_reject_overbroad_age/
What's the deal with Age Verification?,https://www.reddit.com/r/VRchat/comments/1jdvfbi/whats_the_deal_with_age_verification/
Opinion : if you ask for age and date of birth at a club/bar even after seeing someone is 18+ verified you are a power tripping clown,https://www.reddit.com/r/VRchat/comments/1jhm6yx/opinion_if_you_ask_for_age_and_date_of_birth_at_a/
"Pornhub Is Now Blocked In Almost All of the U.S. South. As of today, three more states join the list of 17 that can't access Pornhub because of age verification laws.",https://www.reddit.com/r/technology/comments/1hr4lf3/pornhub_is_now_blocked_in_almost_all_of_the_us/
How does PayPal verify your age?,https://www.reddit.com/r/paypal/comments/rus2tu/how_does_paypal_verify_your_age/
Pornhub to block access in Florida amid lawsuit over state’s age verification law,https://www.reddit.com/r/law/comments/1hiw76d/pornhub_to_block_access_in_florida_amid_lawsuit/
Age verification,https://www.reddit.com/r/VRchat/comments/1j9i7pq/age_verification/
Federal lawsuit filed against Tennessee’s porn age verification law,https://www.reddit.com/r/nashville/comments/1h1coa7/federal_lawsuit_filed_against_tennessees_porn_age/
VRChat is planning to add age verification using third party processor within the year.,https://www.reddit.com/r/VRchat/comments/1dmaktv/vrchat_is_planning_to_add_age_verification_using/
Idea: Age Verification Badge,https://www.reddit.com/r/VRchat/comments/1gx69lt/idea_age_verification_badge/
This will likely lead to interesting case law. Porn is protected by 1A and obscenely insecure age verification requirements has an obvious chilling effect.,https://www.reddit.com/r/PoliticalCompassMemes/comments/1hsptwd/this_will_likely_lead_to_interesting_case_law/
"Canadian policy makers spar over age verification bills S-210, C-412",https://www.reddit.com/r/canada/comments/1gjzavk/canadian_policy_makers_spar_over_age_verification/
Even with the verification system people ask for date of birth,https://www.reddit.com/r/VRchat/comments/1hzkhvd/even_with_the_verification_system_people_ask_for/
Need Help with Age Verification for My Roblox Account,https://www.reddit.com/r/RobloxHelp/comments/1g942a4/need_help_with_age_verification_for_my_roblox/
Court Rules in Pornhub’s Favor in Finding Texas Age-Verification Law Violates First Amendment,https://www.reddit.com/r/supremecourt/comments/166umkz/court_rules_in_pornhubs_favor_in_finding_texas/
Thoughts on 18+ Verified,https://www.reddit.com/r/VRchat/comments/1igy0ul/thoughts_on_18_verified/
Age verification is now out!,https://www.reddit.com/r/VRchat/comments/1hg3q77/age_verification_is_now_out/
"Using blockchain to verify age, is it possible?",https://www.reddit.com/r/BlockchainStartups/comments/zhwcx8/using_blockchain_to_verify_age_is_it_possible/
AGEs index,https://www.reddit.com/r/GalaxyWatch/comments/1eirxbz/ages_index/
Let's talk about staying safe online and minors lying about their age.,https://www.reddit.com/r/BadRPerStories/comments/1555by5/lets_talk_about_staying_safe_online_and_minors/
Are there any dating apps that don't mandate disclosing my age?,https://www.reddit.com/r/dating_advice/comments/tterjg/are_there_any_dating_apps_that_dont_mandate/
Have a question? Read this FAQ first.,https://www.reddit.com/r/beermoney/comments/5hbaz5/have_a_question_read_this_faq_first/
Sniffies now requires age verification to see nudes in my state??,https://www.reddit.com/r/gaybros/comments/1hvka1r/sniffies_now_requires_age_verification_to_see/
Should or should not it be considered rape by deceit to lie about age,https://www.reddit.com/r/AskFeminists/comments/1ct9b30/should_or_should_not_it_be_considered_rape_by/
Important warning about age verification—you can be LOCKED OUT of your own account!,https://www.reddit.com/r/replika/comments/12g0bcl/important_warning_about_age_verificationyou_can/
How to get past Yoti and Verifymyage verifications?,https://www.reddit.com/r/privacy/comments/1booih0/how_to_get_past_yoti_and_verifymyage_verifications/
age verification,https://www.reddit.com/r/AvakinOfficial/comments/1fjfz5j/age_verification/
on the topic of age verification! here’s a shareable guide on how to use the YOTI ID app!,https://www.reddit.com/r/FindomArchive/comments/1jt0xbd/on_the_topic_of_age_verification_heres_a/
ID verification via YOTI and Jumio - help me understand?,https://www.reddit.com/r/CreatorsAdvice/comments/11y27ci/id_verification_via_yoti_and_jumio_help_me/
Yoti is taking too long to verify my documents,https://www.reddit.com/r/PiNetwork/comments/j524yg/yoti_is_taking_too_long_to_verify_my_documents/
Trouble implementing YOTI Documents scan and Identity Verification in my react native application,https://www.reddit.com/r/reactnative/comments/1bvjq5u/trouble_implementing_yoti_documents_scan_and/
Yoti verification issue for jJusteat,https://www.reddit.com/r/JustEatUK/comments/1jz07ox/yoti_verification_issue_for_jjusteat/
on the topic of age verification! here’s a shareable guide on how to use the YOTI ID app!,https://www.reddit.com/r/blackfindomlovers/comments/1jt0wie/on_the_topic_of_age_verification_heres_a/
impossible to verify identity using YOTI??,https://www.reddit.com/r/CamGirlProblems/comments/se430g/impossible_to_verify_identity_using_yoti/
